gopqrcy,https://www.reddit.com/r/RoyaleHighTrading/comments/ls8hb8/lets_talk_about_smol_beans_and_racism_in_royale/gopqrcy/,toastedbutter336,"Im so sorry to hear that--

People who immeadiately jump to conclusions and just forget what sympathizing is--indeed quite alot of people

I hope she can get back to playing rh , and hoping she meets the right people, it really can be a great place, she just had a pretty unlucky start

The next time someone starts to get fussy, leave the server, you cant negotiate with someone who refuses to listen",0.9023
gopt71s,https://www.reddit.com/r/RoyaleHighTrading/comments/ls8hb8/lets_talk_about_smol_beans_and_racism_in_royale/gopt71s/,Space_Itchy,"Thank you for your advice. &lt;3

It really means a lot to me :)",0.6705
gopudkc,https://www.reddit.com/r/RoyaleHighTrading/comments/ls8hb8/lets_talk_about_smol_beans_and_racism_in_royale/gopudkc/,toastedbutter336,"Its no problem at all! 

I wish the best for the both of you ^^",0.8573
gopvaib,https://www.reddit.com/r/RoyaleHighTrading/comments/ls8hb8/lets_talk_about_smol_beans_and_racism_in_royale/gopvaib/,ChocolateTae,"I hate people that make comments about things they don't know anything about. Seriously- ""Her name is in _Chinese_ to seem cute"" These ignorant and insensitive a**holes can't even be bothered to know the difference in characters. People are so quick to assume like all they had to do was see her lvl and realize she was new to trading. I never knew ppl were horrible like that. I'm so sorry that happened to her and I hope u guys can give it another try again in the future ❤️",-0.1972
gopw5tl,https://www.reddit.com/r/RoyaleHighTrading/comments/ls8hb8/lets_talk_about_smol_beans_and_racism_in_royale/gopw5tl/,pisssbabyyy,i like how they called ur friends name a chinese name when it’s a japanese name,0.6808
gopz89p,https://www.reddit.com/r/RoyaleHighTrading/comments/ls8hb8/lets_talk_about_smol_beans_and_racism_in_royale/gopz89p/,xindiliu13,"oh my god i-

the nerve of some people-

now a quick note to self never to make my roleplay name Chinese heh (I'm Chinese btw so like)",0.5777
gopzf9p,https://www.reddit.com/r/RoyaleHighTrading/comments/ls8hb8/lets_talk_about_smol_beans_and_racism_in_royale/gopzf9p/,Stupidest_lemon,I'm sorry to hear that this happened to your friend. People just aren't very nice with all these stereotypes floating around. (Even without stereotypes people are just mean) I do hope she can come back to Royale high and meet new and nicer people.,0.7312
goq1olf,https://www.reddit.com/r/RoyaleHighTrading/comments/ls8hb8/lets_talk_about_smol_beans_and_racism_in_royale/goq1olf/,AllurePlayz,"Im asian so I guess I kinda relate since my grammer isnt the best either, And what they did is super bad like bruh yall have brain- not everyone speaks same language as you or is of the same culture as you.",-0.12
goq28p3,https://www.reddit.com/r/RoyaleHighTrading/comments/ls8hb8/lets_talk_about_smol_beans_and_racism_in_royale/goq28p3/,stray_armyctzen,"ISTG some people need to learn that english is not the only language in the world. The western hemisphere is not the center of the world. Asian languages are not used only to be ""cute"" and ""aesthetic"", they are functional languages that people use to communicate. It's sad to see that languages in asia have been misused to the point that people think that they're only used when someone wants to be ""cute"". And the fact that they were calling the japanese words ""chinese""- they're probably just ignorant white kids living in america or something lmao.",0.6908
goq2ohn,https://www.reddit.com/r/RoyaleHighTrading/comments/ls8hb8/lets_talk_about_smol_beans_and_racism_in_royale/goq2ohn/,izuocha_periodt,bro this is why i read journals! i see their level. and they don’t even know the difference between Japanese and Chinese i-,0.0
goq3a0s,https://www.reddit.com/r/RoyaleHighTrading/comments/ls8hb8/lets_talk_about_smol_beans_and_racism_in_royale/goq3a0s/,Milky_Cake_uwu,A small bean was fighting me and said I think you from Asian because your ugly,-0.7003
goq586g,https://www.reddit.com/r/RoyaleHighTrading/comments/ls8hb8/lets_talk_about_smol_beans_and_racism_in_royale/goq586g/,ImNotCreativeSoYeah,This is so rude because I'm asian and I can confirm this is true,-0.2654
goq69hg,https://www.reddit.com/r/RoyaleHighTrading/comments/ls8hb8/lets_talk_about_smol_beans_and_racism_in_royale/goq69hg/,royalhightraderrr,"Damn. I'm sorry that happened to your friend! It happened to my sister aswell, her grammar is bad and everyone was telling her to ""go back to school"" ""sorry I don't speak gibberish"" and it made her cry. And she hasn't been on the trading hub since. She tells me she's scared incase she gets bullied again. She's 9. And its horrible that people think they're all high and mighty because she's young. We reported the people and hopefully they have learnt there lesson.people have feelings too. And it upsets me to hear this kind of thing.",-0.9538
goq7z9y,https://www.reddit.com/r/RoyaleHighTrading/comments/ls8hb8/lets_talk_about_smol_beans_and_racism_in_royale/goq7z9y/,I_Like_Reuniclus,Can i give her something for free when she comes back?,0.5106
goq84tv,https://www.reddit.com/r/RoyaleHighTrading/comments/ls8hb8/lets_talk_about_smol_beans_and_racism_in_royale/goq84tv/,YukinaSaiona,"i think japanese has some chinese letters in it, so they could think it was chinese

but anyway, that's still really rude of those people to do-",-0.664
goq8dox,https://www.reddit.com/r/RoyaleHighTrading/comments/ls8hb8/lets_talk_about_smol_beans_and_racism_in_royale/goq8dox/,YukinaSaiona,"Wow- I'm Asian, and I hate how everyone instantly assumes that anyone who has a Japanese name/speaks Japanese is a smol bean.

What if they're studying Japanese? What if they *are* Japanese?

those people are toxic af 🤷‍♀️",0.1179
goq8wtp,https://www.reddit.com/r/RoyaleHighTrading/comments/ls8hb8/lets_talk_about_smol_beans_and_racism_in_royale/goq8wtp/,[deleted],[deleted],0.0
goq91sz,https://www.reddit.com/r/RoyaleHighTrading/comments/ls8hb8/lets_talk_about_smol_beans_and_racism_in_royale/goq91sz/,[deleted],[deleted],0.0
goq9enz,https://www.reddit.com/r/RoyaleHighTrading/comments/ls8hb8/lets_talk_about_smol_beans_and_racism_in_royale/goq9enz/,Aydeiaxy,Really...,0.0
goq9ydw,https://www.reddit.com/r/RoyaleHighTrading/comments/ls8hb8/lets_talk_about_smol_beans_and_racism_in_royale/goq9ydw/,izuocha_periodt,yeah ik,0.296
goqaedo,https://www.reddit.com/r/RoyaleHighTrading/comments/ls8hb8/lets_talk_about_smol_beans_and_racism_in_royale/goqaedo/,[deleted],[deleted],0.0
goqanwa,https://www.reddit.com/r/RoyaleHighTrading/comments/ls8hb8/lets_talk_about_smol_beans_and_racism_in_royale/goqanwa/,royalhightraderrr,"She has dyslexia may I add, and yes I try. She struggles with the more complex words and big words as she calls them. Btw I'm a boy. sorry if you misunderstand.",-0.3818
goqao12,https://www.reddit.com/r/RoyaleHighTrading/comments/ls8hb8/lets_talk_about_smol_beans_and_racism_in_royale/goqao12/,pajhlii,"feel the same way. i'm asian as well and honestly online comments are nothing to me. of course you'll get petty sometimes or be annoyed but you have to keep in mind that these people are young teens lol. all you can do is educate them and it's up to them to decide whether they want to be a good person or not because racism against asian's is so normalized now. these people want to be racist but engage in asian culture by liking anime, k-pop and our food.",0.937
goqaz7n,https://www.reddit.com/r/RoyaleHighTrading/comments/ls8hb8/lets_talk_about_smol_beans_and_racism_in_royale/goqaz7n/,[deleted],[deleted],0.0
goqb94p,https://www.reddit.com/r/RoyaleHighTrading/comments/ls8hb8/lets_talk_about_smol_beans_and_racism_in_royale/goqb94p/,pajhlii,"at first i was reading this and wondering when the racism was going to come in and it was at the end lol. i'm okay telling someone that certain names are related to different asian countries but when they try to use it against them in a negative way, that's where i draw the line. hopefully your friend can overcome this and play rh again.",0.7391
goqbbeh,https://www.reddit.com/r/RoyaleHighTrading/comments/ls8hb8/lets_talk_about_smol_beans_and_racism_in_royale/goqbbeh/,xindiliu13,wdym?,0.0
goqd2h2,https://www.reddit.com/r/RoyaleHighTrading/comments/ls8hb8/lets_talk_about_smol_beans_and_racism_in_royale/goqd2h2/,Mariam_Mimi,"That's wrong to assume. I have a baby brother that cannot form a sentence because of how he was born, and for you to assume he's a bad big brother for not helping his sister is just ignorant. Educate yourself.",-0.8693
goqd6pp,https://www.reddit.com/r/RoyaleHighTrading/comments/ls8hb8/lets_talk_about_smol_beans_and_racism_in_royale/goqd6pp/,Mariam_Mimi,"I'm sorry, you had to even read that ignorance coming from them. My wishes go out to your sister and family.",-0.296
goqdryb,https://www.reddit.com/r/RoyaleHighTrading/comments/ls8hb8/lets_talk_about_smol_beans_and_racism_in_royale/goqdryb/,royalhightraderrr,Its alright! Thank you for helping! Stay safe!,0.8582
goqevdn,https://www.reddit.com/r/RoyaleHighTrading/comments/ls8hb8/lets_talk_about_smol_beans_and_racism_in_royale/goqevdn/,cookiegirl202046,is smol beans that bad ;-;,-0.5423
goqf59o,https://www.reddit.com/r/RoyaleHighTrading/comments/ls8hb8/lets_talk_about_smol_beans_and_racism_in_royale/goqf59o/,[deleted],[deleted],0.0
goqguep,https://www.reddit.com/r/RoyaleHighTrading/comments/ls8hb8/lets_talk_about_smol_beans_and_racism_in_royale/goqguep/,iiNotEmiliaii,"This is why I don't like some smol beans- (Not all smol beans!)

I actually got banned from a smol bean :/ she thought I was being rude to her by telling her to stop being racist to white and asian people- because she said some things like ""Whites are all the same"" and ""All white people are bad"" and she also said how she didn't care abt asian lives.When I told her that's really rude- she got all fired up and told me that my life doesn't matter and how only Black Lives Matter :/",-0.9816
goqkfl7,https://www.reddit.com/r/RoyaleHighTrading/comments/ls8hb8/lets_talk_about_smol_beans_and_racism_in_royale/goqkfl7/,Mariam_Mimi,"I understand you didn't know he was a dude, that's not the problem the problem is you assumed he wasn't a good brother, and don't say you didn't say that when you CLEARLY implied it ""Go be a big sister and help her"" you really couldn't have worded it any worse. I don't think you understood the part where he said she was 9, Educate yourself because dyslexia is forever. ""**The** belief that **children with dyslexia will** eventually **outgrow** it is simply not true,"" says lead author Sally E. Shaywitz, MD, of Yale University. Shaywitz tells WebMD that while many bright young adults with **dyslexia** learn to read words accurately, they remain slow readers for a reason."" [https://www.webmd.com/children/news/20000107/dyslexia-is-forever#:\~:text=%22The%20belief%20that%20children%20with,slow%20readers%20for%20a%20reason](https://www.webmd.com/children/news/20000107/dyslexia-is-forever#:~:text=%22The%20belief%20that%20children%20with,slow%20readers%20for%20a%20reason).",0.1909
goqknqt,https://www.reddit.com/r/RoyaleHighTrading/comments/ls8hb8/lets_talk_about_smol_beans_and_racism_in_royale/goqknqt/,Mariam_Mimi,"Of course! I feel like someone had to tell them, they were clearly not well taught. Thank you, Stay safe. &lt;3",0.6671
goqm2li,https://www.reddit.com/r/RoyaleHighTrading/comments/ls8hb8/lets_talk_about_smol_beans_and_racism_in_royale/goqm2li/,[deleted],[deleted],0.0
goqmf5t,https://www.reddit.com/r/RoyaleHighTrading/comments/ls8hb8/lets_talk_about_smol_beans_and_racism_in_royale/goqmf5t/,Akemi_Aki,I'm Asian too I'm Chinese heheh but I really like Japan so rn I'm learning how to speak Japanese and I hope one day I could go to Japan :&gt;,0.8196
goqnsn2,https://www.reddit.com/r/RoyaleHighTrading/comments/ls8hb8/lets_talk_about_smol_beans_and_racism_in_royale/goqnsn2/,Viiviiian,"Yeah, Japanese has kanji too. I mean, tbh you can’t really blame people for mixing languages they don’t even know, but those people were mean anyways so screw them and their uneducated brains. Someone’s race or language should never be used against them!",-0.4287
goqon2p,https://www.reddit.com/r/RoyaleHighTrading/comments/ls8hb8/lets_talk_about_smol_beans_and_racism_in_royale/goqon2p/,ChocolateTae,I really didn't understand how ppl think americans _all_ have a god complex until I moved to another country. Seriously there are bigger things in the world than just us and it's a concept that's lost on ppl stuck in their bubble🙄,-0.4404
goqqh6s,https://www.reddit.com/r/RoyaleHighTrading/comments/ls8hb8/lets_talk_about_smol_beans_and_racism_in_royale/goqqh6s/,Banana_girlthebest,"That’s so rude! I’m Asian (not Japanese I, Indian)! And like just bc ur name is in another language doesn’t mean they r doing it to be “CuTe” it’s so racist and mean! Just bc she is short or doesn’t know values means nothing! If she still played I’d give her a lot of diamonds and items for free! It’s So racist! Please don’t be Racist to anyone!",-0.8122
goqqlim,https://www.reddit.com/r/RoyaleHighTrading/comments/ls8hb8/lets_talk_about_smol_beans_and_racism_in_royale/goqqlim/,Banana_girlthebest,I’m Learning some Mandarin!,0.0
goqqnih,https://www.reddit.com/r/RoyaleHighTrading/comments/ls8hb8/lets_talk_about_smol_beans_and_racism_in_royale/goqqnih/,Banana_girlthebest,Same here!,0.0
goqr6lc,https://www.reddit.com/r/RoyaleHighTrading/comments/ls8hb8/lets_talk_about_smol_beans_and_racism_in_royale/goqr6lc/,Banana_girlthebest,  have experience something like this when I first joined the trading hub also! I’m Indian like I said before. And my Name was in another language and I didn’t know values well and no I did not have heels and I was also called a Smol bean. And yes someone actually said “ur probably just saying you like to read to be “CuTe”! However someone was actually nice enough to help me. if she ever starts playing again and something like this happens again just tell her to leave the server if they r being rude and report them.,0.9515
goqtsuz,https://www.reddit.com/r/RoyaleHighTrading/comments/ls8hb8/lets_talk_about_smol_beans_and_racism_in_royale/goqtsuz/,HeLlotHeReQwQ,"Dude I can relate..

I once was in this trading server when this person wanted to offer for someone halos that their friend said her halos were NFT and bruh-

She then said GO AWAY INDIAN

and then her friend laughed and then they left the server to farm some diamonds

Some ppl just get on my nerves and assume  quickly about people culture &gt;:(( It makes me wanna slap the sooooooooooooo Hard. The person who wanted to offer for the other person's halo didn't know that her halos were NFT. Btw sorry if my grammer is bad lol I am asian and english is not my primary language :II",0.802
goqw22k,https://www.reddit.com/r/RoyaleHighTrading/comments/ls8hb8/lets_talk_about_smol_beans_and_racism_in_royale/goqw22k/,Jasminexx_07,Thid literally happened to me. I was defending this girl because people were being rude then someone says no one asked you chocolate. I was so mad and couldn't even say anything after that so I just left the game. I feel like people think it's funny but it lowkey hurts.,-0.7655
goqwkoj,https://www.reddit.com/r/RoyaleHighTrading/comments/ls8hb8/lets_talk_about_smol_beans_and_racism_in_royale/goqwkoj/,Kittycutieshark111,Wow.,0.5859
goqz0a2,https://www.reddit.com/r/RoyaleHighTrading/comments/ls8hb8/lets_talk_about_smol_beans_and_racism_in_royale/goqz0a2/,ImNotCreativeSoYeah,I speak Mandarin- and it's cool Good luck on learning it!,0.8172
goqz3fj,https://www.reddit.com/r/RoyaleHighTrading/comments/ls8hb8/lets_talk_about_smol_beans_and_racism_in_royale/goqz3fj/,ImNotCreativeSoYeah,😔✌️,0.0772
gor4jgh,https://www.reddit.com/r/RoyaleHighTrading/comments/ls8hb8/lets_talk_about_smol_beans_and_racism_in_royale/gor4jgh/,Namjesus_memes,"Ifkr i am fully chinese and i put my name down and someone attacked me for having a chinese name and saying i just wanna do the ""trend"" and another dude yelled coronavirus in my face at one point. Ngl, im actually proud of being chinese. China is the second highest average iq country. My great great great grandparents were from china too.",0.9246
gor5c8s,https://www.reddit.com/r/RoyaleHighTrading/comments/ls8hb8/lets_talk_about_smol_beans_and_racism_in_royale/gor5c8s/,stray_armyctzen,"fr- I'm still stuck here lmaO but yeah definitely, I never really noticed it before I tried to like... look at it from another country's point of view lol",0.9354
gor7xj9,https://www.reddit.com/r/RoyaleHighTrading/comments/ls8hb8/lets_talk_about_smol_beans_and_racism_in_royale/gor7xj9/,CatBoy-Caretaker,The sad part is that this happens like ALOT. since my English isn't always the best(I was raised being taught  three languages from an early age) Its sad to see other People who dont speak English well get bullied a lot in rh . Like its really sad that people who speak Japanese/Chinese etc. get made fun of for SPEAKING THEIR OWN LANGUAGE. smh sometimes I hate the rh community,-0.9218
gorfpfr,https://www.reddit.com/r/RoyaleHighTrading/comments/ls8hb8/lets_talk_about_smol_beans_and_racism_in_royale/gorfpfr/,yuhitstyra,"Some girl said to me ""ew ur brown"" ""go die"" shouldnt u be in a cage or something"" ""#### poop"" I took pictures aswell her username is 890marshmellow report her if u can :) I also have screenshots",-0.2263
gorgzmi,https://www.reddit.com/r/RoyaleHighTrading/comments/ls8hb8/lets_talk_about_smol_beans_and_racism_in_royale/gorgzmi/,17kAsteroidss,"Like bro.. one time I went with a Japanese name bc I love Japan, like why you gotta ruin it for me..( I used translator sO-)",0.6597
gorh02j,https://www.reddit.com/r/RoyaleHighTrading/comments/ls8hb8/lets_talk_about_smol_beans_and_racism_in_royale/gorh02j/,yuhitstyra,I'm African. Live in England. Even I knwo the difference between a few Asian languages. Chinese characters are more complicated but Korean characters have alot of symbols with an O shape and Japanese characters have alot of box shapes and lines that look a bit like temples Or like the letter N,0.7579
gorn456,https://www.reddit.com/r/RoyaleHighTrading/comments/ls8hb8/lets_talk_about_smol_beans_and_racism_in_royale/gorn456/,Cookies_andcream3466,"That's SO rude-I hope she's okay! I'm not Japanese, but I remember seeing a girl being called names because her name was in Chinese, and I felt so bad bc I am also Chinese so the names she was being called hurt me to-I was going to help her, but she took it very well and calmly left.",0.0843
gorn9qe,https://www.reddit.com/r/RoyaleHighTrading/comments/ls8hb8/lets_talk_about_smol_beans_and_racism_in_royale/gorn9qe/,Cookies_andcream3466,":) I'm Chinese too, this makes me more proud of my culture, ty",0.8399
gorvu8j,https://www.reddit.com/r/RoyaleHighTrading/comments/ls8hb8/lets_talk_about_smol_beans_and_racism_in_royale/gorvu8j/,Kuro_Kuro_,"Tell her that I said her culture and language are beautiful just like her! Her name is beautiful as well and there's nothing wrong with it! 
Some people just don't know how to respect others. The royale high community has drove out a lot of people recently.",0.9561
gos54tb,https://www.reddit.com/r/RoyaleHighTrading/comments/ls8hb8/lets_talk_about_smol_beans_and_racism_in_royale/gos54tb/,Michimocho,I don’t blame her for not knowing values one time this was my first time in the trading hub his girl trades me and asks me to offer for cb sleeves and I didn’t know what to offer so I sat there confused on how this goes  and she said “um hello OFFER!” And “I said sorry it’s my first time here” and then she cancels the trade and say” jeez u are so annoying”,-0.8151
gosaoru,https://www.reddit.com/r/RoyaleHighTrading/comments/ls8hb8/lets_talk_about_smol_beans_and_racism_in_royale/gosaoru/,moomooshroom,She’s the one who traded YOU they have no right to be annoyed lmao 🤌 I hate people like that omg it fires my soul,-0.2732
gosas8q,https://www.reddit.com/r/RoyaleHighTrading/comments/ls8hb8/lets_talk_about_smol_beans_and_racism_in_royale/gosas8q/,Michimocho,Ikr😔✋,0.5423
gosryu9,https://www.reddit.com/r/RoyaleHighTrading/comments/ls8hb8/lets_talk_about_smol_beans_and_racism_in_royale/gosryu9/,Pretty_PainRBN,that’s awful... you should be able to dress and talk however you want. id like to see them speak perfect japanese. i feel so awful this happened to her,-0.0941
gosxgkw,https://www.reddit.com/r/RoyaleHighTrading/comments/ls8hb8/lets_talk_about_smol_beans_and_racism_in_royale/gosxgkw/,Tuvalund,Take my award,0.5423
got7cmw,https://www.reddit.com/r/RoyaleHighTrading/comments/ls8hb8/lets_talk_about_smol_beans_and_racism_in_royale/got7cmw/,DenaAndSara,"If they're okay with arabic

THEN WHY THE FOOK ARE THEY RACIST TOWARDS CHINESE AND JAPANESE???",-0.6568
gotbo86,https://www.reddit.com/r/RoyaleHighTrading/comments/ls8hb8/lets_talk_about_smol_beans_and_racism_in_royale/gotbo86/,piinkfairy,"das not kind :&lt;

their pillow should be warm  &gt;:((",-0.2206
gotbsv7,https://www.reddit.com/r/RoyaleHighTrading/comments/ls8hb8/lets_talk_about_smol_beans_and_racism_in_royale/gotbsv7/,Zenzibaby,Idk why people are like this,0.2732
gotdedy,https://www.reddit.com/r/RoyaleHighTrading/comments/ls8hb8/lets_talk_about_smol_beans_and_racism_in_royale/gotdedy/,Space_Itchy,I'm so sorry that happened to you! I've reported her!,-0.2908
gotdjp5,https://www.reddit.com/r/RoyaleHighTrading/comments/ls8hb8/lets_talk_about_smol_beans_and_racism_in_royale/gotdjp5/,Space_Itchy,"Awe that's so sweet of you! You're so kind! If she decides to come back, I'll ask her and tell her about your kindness &lt;3",0.9156
gotduzo,https://www.reddit.com/r/RoyaleHighTrading/comments/ls8hb8/lets_talk_about_smol_beans_and_racism_in_royale/gotduzo/,Space_Itchy,Thank you for this comment! She really appreciates it! Thank you so much for being so kind &lt;3,0.9301
gote5lz,https://www.reddit.com/r/RoyaleHighTrading/comments/ls8hb8/lets_talk_about_smol_beans_and_racism_in_royale/gote5lz/,I_Like_Reuniclus,"np!
it will be from 10-15k worth btw",0.2942
gyv5dfp,https://www.reddit.com/r/RoyaleHighTrading/comments/ls8hb8/lets_talk_about_smol_beans_and_racism_in_royale/gyv5dfp/,yuhitstyra,I'm learning Japanese too!,0.0
gyv5gwq,https://www.reddit.com/r/RoyaleHighTrading/comments/ls8hb8/lets_talk_about_smol_beans_and_racism_in_royale/gyv5gwq/,yuhitstyra,tf,0.0
h5qpgfp,https://www.reddit.com/r/RoyaleHighTrading/comments/ls8hb8/lets_talk_about_smol_beans_and_racism_in_royale/h5qpgfp/,RoyaleHighLover4Ever,IVE BEEN HER FRIEND BEFORE- whaaat how idk how she unfreinded me but i reported her,0.3108
ls8hb8,https://www.reddit.com/r/RoyaleHighTrading/comments/ls8hb8/lets_talk_about_smol_beans_and_racism_in_royale/,Space_Itchy,"Hello! Once again, back with another anoying rant haha. This time it is more serious. There is a *lot* more racism than you might think. If you are unfamiliar with this topic, let me explain. Racism is when somebody is bulling/treating someone unfairly just because of where they are from, their cultures, beliefs and also skin tone. You might have heard of black lives matter. That rant is for another day. However, there's a big problem with racism to Asian people, especially in royale high. It's not as well known, and that will also be an important thing to know when listening to my story. Let's begin...

This is of course, a true story (as you can probably guess). The story will be about my friend. There is another story, about me, but that's a story for another day. Anyways, my friend at the time had a black and white aesthetic at that time, and her name was in Japanese, because she is, like me, a Japanese person. Her name translates to ""Michiru"". Of course, you may recognise these features to be your stereotypical ""smol bean"". This is very important to the story. We began to enter the trading hub, which was very exciting because it was Michiru's first time going to the trading hub! That's when Michiru did her first trade. Because she had never been in the hub before, she didn't know values at all, so when she offered her cottage princess skirt for this lady's parasol, she was spammed with hurtful messages, calling her a ""smol bean"". She is my irl friend, so she texted me some screenshots, showing me their chat inside the trade box. She was Japanese so her grammar was quite bad, which this girl spread rumors about, saying she was doing it to try and be ""cute"". The server went mad. Everyone was doing what they do here, the jokes, the laughs, everyone was acting like she was a sight to see at a comedy show, when she is a real person who *has feelings*! My friend left the trading hub crying. The words some of these people said were stuff like:

•""LOL a smol bean""-

•""Bruh-""

•""Lol her name is in Chinese so she can seem cute xDD"".

•""I hope both sides of your pillow are warm ☺️""

She has never played royale high since.

 Please don't be rude just because someone has a black and white aesthetic, or because, someone speaks Japanese. Please don't be rude because someone doesn't speak the same language as you. And please, for the love of God, please DO NOT be racist.

Stay safe, everyone.",0.996
