gill32v,https://www.reddit.com/r/dataisbeautiful/comments/kswcrt/oc_the_racial_wealth_gap_in_america/gill32v/,Ccaves0127,"""Hood culture"" is absolutely, 100%, not the ""reason"" for the continuing divisions in society between white and black culture. This is literally a white supremacist dog whistle. Black people were denied property rights for hundreds of years - most cities of the US that have either an ""East"" or ""West"" that is a separate city is because black people weren't allowed to purchase property in the main city. That's what ""redlining"" is. Predominantly black schools, which are in predominantly black areas, are much less likely to be well funded than schools of any other racial makeup.  Black people have also been historically denied loans more often, been historically denied jobs more often, been preventing from middle class opportunities more often - look up how many black WW2 veterans were denied their promised benefits of the GI Bill - and prevented from higher education more often. Even today, when black people have a much higher likelihood of getting into college than ever before, they *still* have much lower rates of college acceptance than white people. If there are two identical people, one black and one white, who get arrested for marijuana possession, the black person on average gets a sentence 8 years longer than the white person. To say we're ""focused on race"" is completely asinine. We can find proven links between all these things and to deny that is to pretend like these problems don't exist - just like what you're doing.",-0.3535
gillhqk,https://www.reddit.com/r/dataisbeautiful/comments/kswcrt/oc_the_racial_wealth_gap_in_america/gillhqk/,Ccaves0127,"Also I'd argue that's because most states with high black population tend to be in the South, an area known for having terrible sex education and birth control laws. In South Carolina you can't say ""vagina"" while teaching sex ed, for example. If you compared white and black southerners it would be much closer, I think.",-0.6705
gilpujy,https://www.reddit.com/r/dataisbeautiful/comments/kswcrt/oc_the_racial_wealth_gap_in_america/gilpujy/,imdoubleliftfanboy,"https://en.m.wikipedia.org/wiki/List_of_ethnic_groups_in_the_United_States_by_household_income

Asian Americans outperform whites in terms of wealth. Very misleading source when they group by other.",0.0534
gin3dlx,https://www.reddit.com/r/dataisbeautiful/comments/kswcrt/oc_the_racial_wealth_gap_in_america/gin3dlx/,G00fy_G00ber69,No you’re missing the point they don’t “choose” the way of life it was forced upon them because of the United States history of fucking over minorities,-0.1311
gina2tn,https://www.reddit.com/r/dataisbeautiful/comments/kswcrt/oc_the_racial_wealth_gap_in_america/gina2tn/,Cyrthazil,"No I do not agree.

Evidently you do not understand how median is calculated. It is entirely unaffected by outliers.",-0.5122
ginar2q,https://www.reddit.com/r/dataisbeautiful/comments/kswcrt/oc_the_racial_wealth_gap_in_america/ginar2q/,robbert_jansen,"Yeah I’m pretty sure Asian would even top many of these statistics, weird not to include them.",0.7783
ginkj44,https://www.reddit.com/r/dataisbeautiful/comments/kswcrt/oc_the_racial_wealth_gap_in_america/ginkj44/,lordicarus,"People have already criticized your comment about hood culture so I'm going to leave that alone. 

But I do feel like there is something to be said about the *general* lack of property ownership in urban centers, which are known to be predominantly black and Hispanic. When you consider the fact that *very few* people in urban centers actually own their primary residence, and very few who live in large cities like NY actually bother with car ownership, it skews this data quite a bit.

Yes, there is a disparity of ownership within those urban centers. The few people who own their primary residence are likely to be white for a variety of reasons probably tying back to institutional racism. However, the difference on home ownership and car ownership here is likely related to the disproportionate number of black and Hispanic people living in urban centers where car and home ownership aren't required.

The reason urban centers are largely populated by minorities is worthy of discussion. But it should be acknowledged that this skews this data in a way that is not representative of the conclusions people tend to draw from this kind of data.",0.1768
ginl7wa,https://www.reddit.com/r/dataisbeautiful/comments/kswcrt/oc_the_racial_wealth_gap_in_america/ginl7wa/,lordicarus,"Median isn't ""calculated"" it's the middle value of the set. If you remove a bunch of items from the set on one side of the median value, the median value would change. If you exclude outliers when ""calculating"" the median, then it is not actually the median value of the set.",0.7717
giobvkm,https://www.reddit.com/r/dataisbeautiful/comments/kswcrt/oc_the_racial_wealth_gap_in_america/giobvkm/,jinxxerr,Could it also be generational wealth that’s it’s factoring in? I imagine there is more generational wealth in white families than non-white in America.,0.7703
gip12f4,https://www.reddit.com/r/dataisbeautiful/comments/kswcrt/oc_the_racial_wealth_gap_in_america/gip12f4/,OnTopOfTheBellCurve,Hey! Your hunch is indeed correct. The paper argues intergenerational wealth transfers matter big time.,0.2481
gip93dr,https://www.reddit.com/r/dataisbeautiful/comments/kswcrt/oc_the_racial_wealth_gap_in_america/gip93dr/,DragonDimos,"How did the asians and the Jews get on top then, there was plenty of racism against them too, how did they manage to not only reach but surpass.",-0.293
gipa8v0,https://www.reddit.com/r/dataisbeautiful/comments/kswcrt/oc_the_racial_wealth_gap_in_america/gipa8v0/,DragonDimos,"Why is it only the black population that suffers from such problems and not the mexicans. Trump even called most of them criminals but they much like asians, in time will reach the white population as they will adopt their culture. If the mexicans can do it, the problem isnt the stereotypes. Do the blacks have lower acceptance rates than the mexicans? Even the immigrants from africa end up richer than the average black, there is a reason obama is from Kenya and not georgia.",0.5136
gipbvl0,https://www.reddit.com/r/dataisbeautiful/comments/kswcrt/oc_the_racial_wealth_gap_in_america/gipbvl0/,DragonDimos,"Jews and asians faced institutional racism, they are now richer than the average white. Mexicans were called mostly criminals from the last president, they were poorer than the average black, came to america with nothing, had basically no education, faced bigger institutional racism but they are now above the average black. The problem with the black communities is on the inside, not the outside and as long as they don't recognize it, it will only end if black communities themselves end (through mixing). I as a greek am an outside observer.",-0.8445
gipc63w,https://www.reddit.com/r/dataisbeautiful/comments/kswcrt/oc_the_racial_wealth_gap_in_america/gipc63w/,DragonDimos,"Not their white neighbours, compare them to the mexicans with no education that came 30 years ago and are now richer. The same mexicans that the past president called mostly criminals.",-0.3612
gipco3g,https://www.reddit.com/r/dataisbeautiful/comments/kswcrt/oc_the_racial_wealth_gap_in_america/gipco3g/,DragonDimos,"Didn't the Jews face even larger instructional racism, didn't the asians come with nothing and no education 80 years ago. Didn't the same happen with the mexicans 30 years ago that the past president called mostly criminals. All those are now richer than the average black. Even the immigrants from africa are richer than the average black which completely throws your point out of the window, there is a reason obama comes from Kenya and not georgia.",-0.0289
gipd23z,https://www.reddit.com/r/dataisbeautiful/comments/kswcrt/oc_the_racial_wealth_gap_in_america/gipd23z/,DragonDimos,The lack of mixing though propably means you do notice.,-0.3182
gipdas9,https://www.reddit.com/r/dataisbeautiful/comments/kswcrt/oc_the_racial_wealth_gap_in_america/gipdas9/,DragonDimos,"The Jews don't cry about 2 millennia of systemic discrimination, they joke about it as they are the richest group in america along with asians. Mexicans were even called mostly criminals by the past president and they are richer than the average black, they came with nothing, no education, not money but they surpassed them. Even the immigrants from africa have surpassed the average black, there is a reason obama is from Kenya and not georgia.",0.5955
gipqzxc,https://www.reddit.com/r/dataisbeautiful/comments/kswcrt/oc_the_racial_wealth_gap_in_america/gipqzxc/,bobthantos,"You, as a Greek, also don't know American history very well. Look into US slavery and the long lasting effects of it. Look into racist laws towards Blacks and the long last effects of it. Look into the Civil Rights movement in the 1960's (less than a century ago, there's no way racism that far back would affect our society today, right??)  
Not looking to further this conversation, but maybe ask yourself does a person's race really define a person? Did these community problems surface not because of race, but because of racism? Is that possible?!?! Clearly you think it's not possible, so we can just leave it there. 

Good luck out there!",-0.624
gipr1pe,https://www.reddit.com/r/dataisbeautiful/comments/kswcrt/oc_the_racial_wealth_gap_in_america/gipr1pe/,mixmatch314,None of these vague generalizations of questionable accuracy excuse or justify the current underrepresentation or mistreatment from a system that claims to aspire to fairness and equality. Interesting way to limit one's worldview in support of a particular viewpoint.,0.5853
giqun03,https://www.reddit.com/r/dataisbeautiful/comments/kswcrt/oc_the_racial_wealth_gap_in_america/giqun03/,G00fy_G00ber69,First of all Jew falls under the white and I’m talking about slavery and everything else up until the civil rights movement which happened not long ago that left African Americans at a great disadvantage compared to everyone else,-0.5423
giquu6z,https://www.reddit.com/r/dataisbeautiful/comments/kswcrt/oc_the_racial_wealth_gap_in_america/giquu6z/,DragonDimos,"Blacks aren't underrepresentated in goverment, latinos are that have similar population but due to them being spread, a lot less positions. The mistreatment was surpassed by the asians and the Jews, it was surpassed by the mexicans too, if they can do it why can't the black population. Till they recognize their unique problems and stop blaming others for them the only way this can end is if black communities end themselves.",-0.8922
giqvu6l,https://www.reddit.com/r/dataisbeautiful/comments/kswcrt/oc_the_racial_wealth_gap_in_america/giqvu6l/,[deleted],[removed],0.0
giqw0xj,https://www.reddit.com/r/dataisbeautiful/comments/kswcrt/oc_the_racial_wealth_gap_in_america/giqw0xj/,DragonDimos,"No, I am pretty sure the mexicans that came to america 30 years ago with nothing had a disadvantage compared to the blacks that had 60 years to built something, yet the mexicans are now richer.",0.8815
girjd43,https://www.reddit.com/r/dataisbeautiful/comments/kswcrt/oc_the_racial_wealth_gap_in_america/girjd43/,mixmatch314,"Don't you thing believing and saying things that are supported by reality would be a better way to live? I understand you want to propagate these beliefs for some reason, I just don't see the point.",0.6705
givadvk,https://www.reddit.com/r/dataisbeautiful/comments/kswcrt/oc_the_racial_wealth_gap_in_america/givadvk/,kyunlee,"African Americans have an institutional advantage over asian Americans.  An asian student would only have a 10% chance if acceptance into Yale with the same academic scores as a black person the DOJ found when they sued them.  Same for most universities in America have affirmative action that gives a ridiculous race preference to black students while making it much harder for Asian students. As well as many scholarships,  financial aid going towards African Americans and none the same equally qualified asian students. Lack of funding? Asians have the highest poverty rate in NYC but 2002 to 2014 ― a 13 year period ― they receive only 1.4 of the city social services funds. They had every single opportunity to succeed with the help of institutional racism.

https://m.huffpost.com/us/entry/us_58ff7f40e4b0c46f0782a5b6",0.7096
givaqlw,https://www.reddit.com/r/dataisbeautiful/comments/kswcrt/oc_the_racial_wealth_gap_in_america/givaqlw/,kyunlee,"It's almost like this suvery has an intentional political agenda by excluding Asians. Yeah, its hard to make the racism argument when Asians are included.",-0.5563
giwfb0l,https://www.reddit.com/r/dataisbeautiful/comments/kswcrt/oc_the_racial_wealth_gap_in_america/giwfb0l/,ThePandaRider,"&gt; Why do predominately black communities fall into this? No way it can be institutional racism, right? They choose that lifestyle, because they're black! lol -- nice theory

They do choose that lifestyle. When you get down to it communities have a lot of choices. Their can collect taxes and spend money on whatever is important to them. If education is a problem in a particular community than raise taxes and increase the school's funding. If there is a crime problem then raise taxes and increase the police department's budget.",-0.7312
gizvsve,https://www.reddit.com/r/dataisbeautiful/comments/kswcrt/oc_the_racial_wealth_gap_in_america/gizvsve/,bobthantos,"WHY do they ""choose"" this lifestyle? Is it because they're Black? That's literally the only thing I'm arguing. This lifestyle can be seen in many impoverished communities; look at gangs in Latin America, weird how it's a ton of Latinos and not completely Blacks choosing this ""hood lifestyle""  


And the tax thing is the main issue, the problem is it's hard to get taxes from people who don't have a lot to begin with. Thank you for agreeing we need more taxes and increase school's funding, unfortunately that doesn't happen. A lot of funding comes from local taxes, and if the area is impoverished, you can imagine there's not going to be a lot of tax income  


[https://www.npr.org/2016/04/18/474256366/why-americas-schools-have-a-money-problem](https://www.npr.org/2016/04/18/474256366/why-americas-schools-have-a-money-problem)",-0.476
gj02lgq,https://www.reddit.com/r/dataisbeautiful/comments/kswcrt/oc_the_racial_wealth_gap_in_america/gj02lgq/,ThePandaRider,"&gt; WHY do they ""choose"" this lifestyle? Is it because they're Black?

Being black has nothing to do with it. Plenty of towns choose to have weak institutions in order to avoid paying taxes. Plenty of towns have enough money to properly address their problems but don't hold their politicians accountable when the politicians steal the money. 

&gt; And the tax thing is the main issue, the problem is it's hard to get taxes from people who don't have a lot to begin with. 

It shouldn't be hard if the people want good services. The issue is that they don't want them, not enough to pay for them. That's part of the poverty trap right? Spending too much on low quality products and services because they are cheap. 

It's not like getting a community up and running is rocket science. People with far fewer resources, way back when your transportation options were walking and the literacy rate was nearly zero figured it out. The key is to get responsible people elected, but that doesn't seem to be something poorer communities are interested in to their own detriment.",-0.9517
gjdf1w6,https://www.reddit.com/r/dataisbeautiful/comments/kswcrt/oc_the_racial_wealth_gap_in_america/gjdf1w6/,Cyrthazil,"As a computer programmer, I call that calculating. I see where you are coming from though.  
You actually do understand how the median value is ""procured"" - let's say - from a dataset. However, if we remove a tiny, tiny fraction of values from either end of the distribution, the median is highly unlikely to change. This is because there will be many, many times more people earning the median wage (all in the same wage bracket).   
I maintain that you are exceedingly unlikely to affect the median by removing a tiny number of data points from one end of the distribution.",0.6597
kswcrt,https://www.reddit.com/r/dataisbeautiful/comments/kswcrt/oc_the_racial_wealth_gap_in_america/,preitylo,,0.0
