fvcawhq,https://www.reddit.com/r/drawing/comments/hc1qww/blacklivesmatter_alllivesmatter_not_all_black/fvcawhq/,Da_Fabulous_Duck,Love the lips,0.6369
fvcay01,https://www.reddit.com/r/drawing/comments/hc1qww/blacklivesmatter_alllivesmatter_not_all_black/fvcay01/,bott367,No one thinks “Chinese People” are the cause of virus. That was propaganda the Chinese government spread over the media to protect thier facist government from blame for not handleing the crisis at all.,0.0757
fvcjq70,https://www.reddit.com/r/drawing/comments/hc1qww/blacklivesmatter_alllivesmatter_not_all_black/fvcjq70/,Lady_LaClaire,There are some in the Trump camp who still call it the Chinese virus and blame the Chinese for the virus.,-0.34
fvcljhh,https://www.reddit.com/r/drawing/comments/hc1qww/blacklivesmatter_alllivesmatter_not_all_black/fvcljhh/,bott367,Pretty sure they are blaming the government not the people.,0.3182
fvcm611,https://www.reddit.com/r/drawing/comments/hc1qww/blacklivesmatter_alllivesmatter_not_all_black/fvcm611/,Lady_LaClaire,News reports around here showed people being prejudiced concerning the Chinese population with people throwing racial slurs their way.,-0.4404
fvcnpfm,https://www.reddit.com/r/drawing/comments/hc1qww/blacklivesmatter_alllivesmatter_not_all_black/fvcnpfm/,bott367,"Chinese government is the problem not the people being held hostage. Many of the race narratives are being used by corporate media to create more racism and division 

[new article about China media outlets ](https://www.theguardian.com/news/2018/dec/07/china-plan-for-global-media-dominance-propaganda-xi-jinping)",-0.7178
fvcnu3v,https://www.reddit.com/r/drawing/comments/hc1qww/blacklivesmatter_alllivesmatter_not_all_black/fvcnu3v/,Lady_LaClaire,I’m not saying it isn’t. I’m saying this is how some racist Americans have been behaving.,-0.6124
fvcuasp,https://www.reddit.com/r/drawing/comments/hc1qww/blacklivesmatter_alllivesmatter_not_all_black/fvcuasp/,oKaczko,"Saying that it’s a Chineae virus, and blaming China for it, doesn’t put you in the “Trump camp”. That China has to be held accountable should not be a partisan issue.",-0.4939
fvcul18,https://www.reddit.com/r/drawing/comments/hc1qww/blacklivesmatter_alllivesmatter_not_all_black/fvcul18/,oKaczko,"Of course there are assholes who blame individuals unjustly, but that’s just a media spin. You should not let rude individuals distract you from the Chinese government’s manipulation of the virus.",-0.6684
fvcuyd8,https://www.reddit.com/r/drawing/comments/hc1qww/blacklivesmatter_alllivesmatter_not_all_black/fvcuyd8/,oKaczko,"If only people listened to Martin Luther King, but sadly people insist on being tribal. Individualism is the only way..",-0.5719
fvcvrl4,https://www.reddit.com/r/drawing/comments/hc1qww/blacklivesmatter_alllivesmatter_not_all_black/fvcvrl4/,Lady_LaClaire,I’m just quoting news sources I’ve seen in my neck of the woods.,0.0
fvcw2an,https://www.reddit.com/r/drawing/comments/hc1qww/blacklivesmatter_alllivesmatter_not_all_black/fvcw2an/,Lady_LaClaire,"I am not. Others here in this region are though. If anything, I’ve tried to have discussions with people calling it the “Chinese Virus” to keep them from perpetuating that perspective.",0.0
fvcxajq,https://www.reddit.com/r/drawing/comments/hc1qww/blacklivesmatter_alllivesmatter_not_all_black/fvcxajq/,oKaczko,"That’s perfectly reasonable. The other side of that coin, however, is that people who are actively trying to call the Chinese government to accountability, are being accused of racism, where there is none.

Sadly America has become so extremely polarised that you are expected to represent one camp or the other, and the silent majority, who I believe are generally reasonable, are allowing the public discourse to turn into this.",0.3678
fvcxnvs,https://www.reddit.com/r/drawing/comments/hc1qww/blacklivesmatter_alllivesmatter_not_all_black/fvcxnvs/,Lady_LaClaire,True enough. There are so many that I’ve tried to reason with and they won’t have any of it. That’s why I’m sticking with Reddit and have locked down my IG account. Some people are down right nasty currently.,-0.2023
fvcyz4r,https://www.reddit.com/r/drawing/comments/hc1qww/blacklivesmatter_alllivesmatter_not_all_black/fvcyz4r/,oKaczko,"Haha. Even Reddit gives me stress. But Twitter is the ultimate hive of radicalisation.

But hey, slightly offtopic, are you familiar with Dave Rubin? I think you’d be really into his show, the Rubin Report. He’s a wonderful interviewer and hosts a lot of public thinkers who are trying to make sense of the whole problem with culture and politics today. Whenever I listen to some of his interviews, I find some measure of comfort, as I no longer feel like I’m alone in this politically insane world.",0.0644
fvczfb0,https://www.reddit.com/r/drawing/comments/hc1qww/blacklivesmatter_alllivesmatter_not_all_black/fvczfb0/,Lady_LaClaire,"I’ve heard that name, but did not know that’s who it was. What’s the best way to check it out?",0.7783
fvczx5x,https://www.reddit.com/r/drawing/comments/hc1qww/blacklivesmatter_alllivesmatter_not_all_black/fvczx5x/,SamWise1973,But wasn't George Floyd a convicted criminal and drug user?,-0.6808
fvd1qlz,https://www.reddit.com/r/drawing/comments/hc1qww/blacklivesmatter_alllivesmatter_not_all_black/fvd1qlz/,Sable_official,Hispanics and Natives?,0.0
fvd2807,https://www.reddit.com/r/drawing/comments/hc1qww/blacklivesmatter_alllivesmatter_not_all_black/fvd2807/,do-a-big-flip,I love this !! Really beautiful it shows that we are ALL human and we all just want to be happy despite our differences ❤️,0.9322
fvd2e66,https://www.reddit.com/r/drawing/comments/hc1qww/blacklivesmatter_alllivesmatter_not_all_black/fvd2e66/,oKaczko,"Youtube. Probably best to check through his catalog and see if he’s interviewing any familiar names first.

But off the top of my head, I can recommend his interview with Larry Elder. He challenges the general racism narrative very insightfully.

Also his Jordan Peterson interviews are incredibly powerful stuff. He has spent decades studying what causes people to become so unreasonable and extremist.

Let me know what you think, once you’ve checked it out.",0.7175
fvd3eum,https://www.reddit.com/r/drawing/comments/hc1qww/blacklivesmatter_alllivesmatter_not_all_black/fvd3eum/,Lady_LaClaire,👍🏼,0.0
fvd4k7m,https://www.reddit.com/r/drawing/comments/hc1qww/blacklivesmatter_alllivesmatter_not_all_black/fvd4k7m/,MakeThatMatt,Not all cops are racist,-0.6124
fvd5tsu,https://www.reddit.com/r/drawing/comments/hc1qww/blacklivesmatter_alllivesmatter_not_all_black/fvd5tsu/,Christhimself609,"If you wanna be like’oh all lives matter tooo’ then yeah. You gotta include everyone lmao

Native folks have it SO hard and they deserve better",0.7444
fvd5zl2,https://www.reddit.com/r/drawing/comments/hc1qww/blacklivesmatter_alllivesmatter_not_all_black/fvd5zl2/,Christhimself609,"Oops looks like no one asked

Just like Floyd being a user didn’t mean he asked to be killed one of the most slow and painful scenes of public violence and murder any of us have ever seen",-0.9399
fvd64fz,https://www.reddit.com/r/drawing/comments/hc1qww/blacklivesmatter_alllivesmatter_not_all_black/fvd64fz/,Christhimself609,I would be very wary of the tag ‘all lives matter’ since it’s used by anti-protestors and white trash.. not that they aren’t the exact same thing,0.0
fvd6f79,https://www.reddit.com/r/drawing/comments/hc1qww/blacklivesmatter_alllivesmatter_not_all_black/fvd6f79/,Cyb3rnaut13,I love this. Keep up the great work!,0.8622
fvd6gyi,https://www.reddit.com/r/drawing/comments/hc1qww/blacklivesmatter_alllivesmatter_not_all_black/fvd6gyi/,dbabiondamic,no one asked you either.. keep moving,-0.296
fvd6rbx,https://www.reddit.com/r/drawing/comments/hc1qww/blacklivesmatter_alllivesmatter_not_all_black/fvd6rbx/,Christhimself609,Ownowww did I upswt a rawsiswt?,0.0
fvd724d,https://www.reddit.com/r/drawing/comments/hc1qww/blacklivesmatter_alllivesmatter_not_all_black/fvd724d/,dbabiondamic,"yes, he was a career criminal. if these people (who claim that punk wasnt a threat) were friends or family to a pregnant female who was held at gun point, by george floyd (i hate typing that name), i dont think they'd feel the same way about him. there is something in the water that most of these brainwashed people are drinking and its not good.. not good at all

edit: that actually happened btw. along with several other arrests. im ok with second chances in life, i really am, but after that you are considered a low life in my book. and people say ""but he was getting his life back together"".. shut up, he was under the influence of fentanyl and methamphetamine during his arrest. the media wont show you the ""whole video"" either because it doesnt fit their narrative.. he WAS resisting right after he threw a baggy containing a white substance on the ground.. smh",-0.8992
fvd7r5c,https://www.reddit.com/r/drawing/comments/hc1qww/blacklivesmatter_alllivesmatter_not_all_black/fvd7r5c/,dbabiondamic,typical. im african american bubby married to a white woman with three kids. and you call me racist haha,-0.25
fvd7w8h,https://www.reddit.com/r/drawing/comments/hc1qww/blacklivesmatter_alllivesmatter_not_all_black/fvd7w8h/,dbabiondamic,i dont have a small mind like most others of my race. this whole thing is for political reasons. it happens every election year. all lives matter. one love,0.7783
fvd7yay,https://www.reddit.com/r/drawing/comments/hc1qww/blacklivesmatter_alllivesmatter_not_all_black/fvd7yay/,Christhimself609,"Well I’m a white woman engaged to an African American man with no kids. Congratulations.

You can still be racist. And if not racist them just a general price of shit",-0.7119
fvd81dk,https://www.reddit.com/r/drawing/comments/hc1qww/blacklivesmatter_alllivesmatter_not_all_black/fvd81dk/,[deleted],[deleted],0.0
fvd96b9,https://www.reddit.com/r/drawing/comments/hc1qww/blacklivesmatter_alllivesmatter_not_all_black/fvd96b9/,Christhimself609,"Cute

Your still gross and belittling an entire movement based of the fact a guy had a past damn. That’s pretty fucked up dude?
Imagine saying some dude deserves to die a painful ass death coz the conservative media wants to pain his whole life as one of crime. He had a fucking kid man. He was just going to the shops

As a black dude urself aren’t you a little fucking worried you might get gee ... iunno murdered by racist ass cops for not indicating soon enough or, having an air freshener in your car or ‘matching a description?

Maybe you don’t are but I do. The idea of me losing my fiancé because some subhuman pig man in a uniform is having a bad day. It’s gotten to the point where we know we can’t live in America. We know our future kids won’t be safe there.

Maybe Floyd isn’t the best martyr for this movement it he still didn’t deserve what happened to him and that’s the principle of this movement. You shouldn’t have to be anything in order to not be murdered by police 

So yeah. You suck dude. He wasn’t a threat and even if he was they didn’t need to stand on his neck or keep standing on it as he expressed his inability to breath",-0.964
fvd9bp3,https://www.reddit.com/r/drawing/comments/hc1qww/blacklivesmatter_alllivesmatter_not_all_black/fvd9bp3/,Christhimself609,That’s seriously disgusting. I hope your children grow up idealising someone other then you.,-0.1531
fvdaoy2,https://www.reddit.com/r/drawing/comments/hc1qww/blacklivesmatter_alllivesmatter_not_all_black/fvdaoy2/,nepenthye,I agree but in terms of this artwork cops wouldn’t really fit since that’s a career choice and not something you’re born as and have no control over.,0.3898
fvdgiov,https://www.reddit.com/r/drawing/comments/hc1qww/blacklivesmatter_alllivesmatter_not_all_black/fvdgiov/,SamWise1973,"I didn't say he deserved to die. This artist says he wasn't a threat. I'm saying, he held a pregnant woman at gunpoint while his friends ransacked her home. So yeah, saying he wasn't a threat is BS. I'm correcting the artist who is misinformed.",0.6147
fvdgltu,https://www.reddit.com/r/drawing/comments/hc1qww/blacklivesmatter_alllivesmatter_not_all_black/fvdgltu/,SamWise1973,How does that make either of us racist?,-0.6124
fvdhmqp,https://www.reddit.com/r/drawing/comments/hc1qww/blacklivesmatter_alllivesmatter_not_all_black/fvdhmqp/,dietderpsy,"Then don't support movements that promote racist concepts such as ""white privilege""",-0.2865
fverjpg,https://www.reddit.com/r/drawing/comments/hc1qww/blacklivesmatter_alllivesmatter_not_all_black/fverjpg/,Blackberry_Fox,"This is amazing, I love it!",0.8516
fvgeme3,https://www.reddit.com/r/drawing/comments/hc1qww/blacklivesmatter_alllivesmatter_not_all_black/fvgeme3/,MakeThatMatt,That is true,0.4215
fvmj2in,https://www.reddit.com/r/drawing/comments/hc1qww/blacklivesmatter_alllivesmatter_not_all_black/fvmj2in/,sahiba_manchanda,Thank you! ☺️,0.6996
fxdhzle,https://www.reddit.com/r/drawing/comments/hc1qww/blacklivesmatter_alllivesmatter_not_all_black/fxdhzle/,[deleted],[removed],0.0
fxdi6rl,https://www.reddit.com/r/drawing/comments/hc1qww/blacklivesmatter_alllivesmatter_not_all_black/fxdi6rl/,Jackeduponcrack,stupid fucking kids....,-0.5267
fzwffmh,https://www.reddit.com/r/drawing/comments/hc1qww/blacklivesmatter_alllivesmatter_not_all_black/fzwffmh/,phyzxqz,"Ok karen, Nobody asked for your opinion",0.296
fzwqbll,https://www.reddit.com/r/drawing/comments/hc1qww/blacklivesmatter_alllivesmatter_not_all_black/fzwqbll/,Christhimself609,Bruh lmao you sound like just the pos i was talking about,0.7506
fzxdrb8,https://www.reddit.com/r/drawing/comments/hc1qww/blacklivesmatter_alllivesmatter_not_all_black/fzxdrb8/,phyzxqz,"Karen, This is why you cant get friends",-0.3724
fzxi2ln,https://www.reddit.com/r/drawing/comments/hc1qww/blacklivesmatter_alllivesmatter_not_all_black/fzxi2ln/,Christhimself609,;),0.2263
fzxikk8,https://www.reddit.com/r/drawing/comments/hc1qww/blacklivesmatter_alllivesmatter_not_all_black/fzxikk8/,phyzxqz,Ok karen,0.296
fzxl9kf,https://www.reddit.com/r/drawing/comments/hc1qww/blacklivesmatter_alllivesmatter_not_all_black/fzxl9kf/,Christhimself609,;),0.2263
g0scqgo,https://www.reddit.com/r/drawing/comments/hc1qww/blacklivesmatter_alllivesmatter_not_all_black/g0scqgo/,Sable_official,"I love the picture sorry if you took it the wrong way, I'm pointing out the Hispanics and Natives because they are people too",0.2023
