g2pa23p,https://www.reddit.com/r/fatlogic/comments/ifn3o9/artist_thinks_that_being_skinny_and_japanese_isnt/g2pa23p/,Blutarg,"What is ""gross"" about that character?",-0.4767
g2pado5,https://www.reddit.com/r/fatlogic/comments/ifn3o9/artist_thinks_that_being_skinny_and_japanese_isnt/g2pado5/,99Poppies,I think maybe the exposed breasts and rather revealing outfit may be a part of the issue.,-0.0772
g2pbfpm,https://www.reddit.com/r/fatlogic/comments/ifn3o9/artist_thinks_that_being_skinny_and_japanese_isnt/g2pbfpm/,stnstrwbrry,"I know but she could've just changed the outfit and gave her a modest look, not change her race and make her fat like that's also a problem",-0.0772
g2pc77o,https://www.reddit.com/r/fatlogic/comments/ifn3o9/artist_thinks_that_being_skinny_and_japanese_isnt/g2pc77o/,kikipinpin,"There was some discussion of that 'artist' elsewhere on Reddit the other day and the general consensus seemed to be that it's a parody account from someone who is essentially pretending to be an uber-SJW cliche character. I don't know for sure but I would certainly tend to think they are a parody/troll account aimed at pissing people off, based on their Twitter profile.

Either way ... they make \*all\* characters fat and black and they always give them weird tree-trunk legs that make them look like they've got lymphoedema.",0.1202
g2pdazi,https://www.reddit.com/r/fatlogic/comments/ifn3o9/artist_thinks_that_being_skinny_and_japanese_isnt/g2pdazi/,stnstrwbrry,Oh wow the sarcasm got me lol. I got wooshed hard,0.6486
g2pdfzw,https://www.reddit.com/r/fatlogic/comments/ifn3o9/artist_thinks_that_being_skinny_and_japanese_isnt/g2pdfzw/,trashQueen1947,As an art student I know a lot of these kinds of artists irl (unfortunately). I’m from Colorado and my high school was kinda famous for the athletic programs and so there were like 4 visibly overweight people in my whole school. Then I come to art school in the south and MANY of my classmates are really fat! I was not expecting that so being a bit culture shocked I was a bit too formal to most overweight girls I met and they took my niceness for either me hitting on them or trying to become instant bffs. Honestly I feel bad for some of the girls that I befriended early on and then had to tell I wasn’t into after they asked me to be gfs. Many where really nice and honestly just fat because they had been through a lot in life and had bad relationships with food. Then there’s girls like this artist who treated it like a “quirky” personality trait.,0.4623
g2ph7a1,https://www.reddit.com/r/fatlogic/comments/ifn3o9/artist_thinks_that_being_skinny_and_japanese_isnt/g2ph7a1/,jesuismexican,"There’s ways to have a less revealing clothing for sure especially because the character is 16 but her superpower in MHA is to pull stuff out of her skin, with larger objects needing to come out of large gaps in her clothing. Kinda part of her power. The new version doesn’t really account for that, it’s basically a completely different hero",0.7886
g2plky1,https://www.reddit.com/r/fatlogic/comments/ifn3o9/artist_thinks_that_being_skinny_and_japanese_isnt/g2plky1/,timecube_traveler,"That outfit always peeved me off even with the in-lore explanation because it's designed to be sexy but like.. You can have way more skin showing for having huge stuff coming out of it with a more modest outfit. Maybe a sports bra, shorts and sneakers instead of boots because calves are a kinda big body parts they're missing out on. It's a pet peeve of mine.",0.6808
g2pmaen,https://www.reddit.com/r/fatlogic/comments/ifn3o9/artist_thinks_that_being_skinny_and_japanese_isnt/g2pmaen/,jesuismexican,"I agree completely. A sporty outfit would make more sense and would probably be more useful anyway within the context of the show. 

Also her ability to create stuff is based off of food consumption which is why she’s so skinny, the character on the right just throws that all out. Half the fun of the show/books is how specific and limited the powers are sometimes in my opinion",0.8883
g2pn9fa,https://www.reddit.com/r/fatlogic/comments/ifn3o9/artist_thinks_that_being_skinny_and_japanese_isnt/g2pn9fa/,Terytha,"I think the author of MHA draws some of the most realistic bodies I've seen though, generally oversized boobs notwithstanding. There's even a literal obese hero. As in that's his power.",0.5574
g2pp1n9,https://www.reddit.com/r/fatlogic/comments/ifn3o9/artist_thinks_that_being_skinny_and_japanese_isnt/g2pp1n9/,acjj1990,"But her ability is to create from using her own fat, which is why her outfit leaves her stomach visible.

Sure you can gather fat from your arms, but most fat is usually localizers to ones abdomen.",0.8201
g2prlsm,https://www.reddit.com/r/fatlogic/comments/ifn3o9/artist_thinks_that_being_skinny_and_japanese_isnt/g2prlsm/,stnstrwbrry,"I mean she got fat in her boobs, her quirk benefits from it I would assume",0.3818
g2pu58c,https://www.reddit.com/r/fatlogic/comments/ifn3o9/artist_thinks_that_being_skinny_and_japanese_isnt/g2pu58c/,atrahal,"On a serious note, not the weird tweet perspective: Momo is 15-16 and craaazy sexualized. Her costume could show skin (so she can use her powers) without being tits out and a miniskirt. Stretchy armored shorts, armored boots, a sports bra or crop style top. Overall Horikoshi does a great job with character design but poor Yaomomo got the short end of the fan service stick.",0.2942
g2q47om,https://www.reddit.com/r/fatlogic/comments/ifn3o9/artist_thinks_that_being_skinny_and_japanese_isnt/g2q47om/,TheCapitalKing,"It’s a Japanese show all their shows have girls half naked for everything. It’s the main reason I don’t watch more of them. Like why does this cartoon character need double d’s that are completely visible, I just wanted to watch a fun show about turning the moon into a fighting robot",0.552
g2q4iwr,https://www.reddit.com/r/fatlogic/comments/ifn3o9/artist_thinks_that_being_skinny_and_japanese_isnt/g2q4iwr/,TheCapitalKing,It wouldn’t really be an anime without enough cleavage to make it really uncomfortable to recommend the show to a friend,0.4715
g2q4wn4,https://www.reddit.com/r/fatlogic/comments/ifn3o9/artist_thinks_that_being_skinny_and_japanese_isnt/g2q4wn4/,Terytha,"There are very few exceptions to this, yes. Anime artists like boobs.

Who can blame them though really.",0.4981
g2q6m5j,https://www.reddit.com/r/fatlogic/comments/ifn3o9/artist_thinks_that_being_skinny_and_japanese_isnt/g2q6m5j/,TheCapitalKing,The liking is fine. The drawing is less chill,0.5423
g2qaxxf,https://www.reddit.com/r/fatlogic/comments/ifn3o9/artist_thinks_that_being_skinny_and_japanese_isnt/g2qaxxf/,Mighty_Zhdun,"Honestly, more modestly dressed, chunky, and darker skinned characters would be totally cool but... This character isn't those things. You don't have to be a fan of a show or book or comic, and if you think they aren't diverse enough, go ahead and never give them your disposable income. But being a 'fan' whilst doing stuff like this really confuses me. You .. don't like the character?",0.7088
g2qbf84,https://www.reddit.com/r/fatlogic/comments/ifn3o9/artist_thinks_that_being_skinny_and_japanese_isnt/g2qbf84/,Mighty_Zhdun,"Ah I see, twas a parody account. I agree there's a diversity problem and an oversexualization problem with a lot of media, but therefore I don't watch or read said media, but I do understand why people come up with alternative designs like this (actual people, not parody accounts), but I personally prefer trying to make my own media instead. I wrote a novel because I was salty about not having autistic women in sci fi stories, and now, in my small book, it's canon. In my opinion that is more progress than headcanoning a popular character as autistic when They Aren't ™",0.92
g2qg3vu,https://www.reddit.com/r/fatlogic/comments/ifn3o9/artist_thinks_that_being_skinny_and_japanese_isnt/g2qg3vu/,finalflash45,"Being skinny and Japanese is a big no no.
Being black and fat? That's perfectly fine.",0.5859
g2qo5t7,https://www.reddit.com/r/fatlogic/comments/ifn3o9/artist_thinks_that_being_skinny_and_japanese_isnt/g2qo5t7/,Hoofwoof,Momo would be dead by now if she was wearing that.  I don't even think the boys' uniforms are that covering and she relies on exposed skin to use her power.  She'd be dead lol,-0.7964
g2qpdzv,https://www.reddit.com/r/fatlogic/comments/ifn3o9/artist_thinks_that_being_skinny_and_japanese_isnt/g2qpdzv/,tpfang56,"even though this is a troll account, I have seen a few artists like that on tumblr where they make white or light-skinned/thin/fit characters fat and racebent. it always looks so ugly because of the particular art style they adopt. I hate it and it causes me visceral disgust on sight, but I don’t think its okay to harass said artists like people are prone to do on twitter. 

I hate momo’s design too tbh but meh, male shounen authors fail hard at female characters in almost every instance.",-0.9507
g2qxpzq,https://www.reddit.com/r/fatlogic/comments/ifn3o9/artist_thinks_that_being_skinny_and_japanese_isnt/g2qxpzq/,Raikou0215,Just a dang cloak would do the trick.,-0.0516
g2qygcy,https://www.reddit.com/r/fatlogic/comments/ifn3o9/artist_thinks_that_being_skinny_and_japanese_isnt/g2qygcy/,thereefulfreble,"Yeah, or even just have an exposed back to pull the big stuff out of",0.2263
g2qyhds,https://www.reddit.com/r/fatlogic/comments/ifn3o9/artist_thinks_that_being_skinny_and_japanese_isnt/g2qyhds/,haikusbot,"*Yeah, or even just*

*Have an exposed back to pull*

*The big stuff out of*

\- thereefulfreble

---

^(I detect haikus. And sometimes, successfully.) ^[Learn&amp;#32;more&amp;#32;about&amp;#32;me.](https://www.reddit.com/r/haikusbot/)

^(Opt out of replies: ""haikusbot opt out"" | Delete my comment: ""haikusbot delete"")",0.6249
g2qzetx,https://www.reddit.com/r/fatlogic/comments/ifn3o9/artist_thinks_that_being_skinny_and_japanese_isnt/g2qzetx/,atrahal,"As Edna Mode says, NO CAPES!

More seriously, a cloak wouldn’t solve the lack of boob support and chest coverage Momo has, especially if it’s an open cloak or it covers enough fat reservoirs and skin that she can’t use her quirk effectively. Plus, that would just lead to “ooo is she wearing ANYTHING under it??” sexualisation. Gross. Just give her a normal top and bottoms that don’t invite panty shot fan art.",0.3455
g2qzl5n,https://www.reddit.com/r/fatlogic/comments/ifn3o9/artist_thinks_that_being_skinny_and_japanese_isnt/g2qzl5n/,bisonbarbie,Good bot,0.4404
g2r1i6t,https://www.reddit.com/r/fatlogic/comments/ifn3o9/artist_thinks_that_being_skinny_and_japanese_isnt/g2r1i6t/,stnstrwbrry,"I agree there are diversity problems in media but tbh MHA has a lot of body types. There is a fat person, a skinny person, a curvy person and of course a buff person. But they are Japanese so they shouldn't turn black. 

And you're right, there should be autistic women in scifi stories. It would be very cool to see that!",0.5546
g2r1ovp,https://www.reddit.com/r/fatlogic/comments/ifn3o9/artist_thinks_that_being_skinny_and_japanese_isnt/g2r1ovp/,stnstrwbrry,Or she'd have to rip her unrevealing clothes in every episode just to use her  powers whenever someone comes along. And then Mineta would have a nosebleed right after,0.0
g2r23xu,https://www.reddit.com/r/fatlogic/comments/ifn3o9/artist_thinks_that_being_skinny_and_japanese_isnt/g2r23xu/,stnstrwbrry,"I don't like it when people can't admit to themselves that this can be a problem and embrace it to the point where it gets stupid. It's okay to be fat, but to convince people that it's a quirk thing is just weird",-0.3294
g2r3rch,https://www.reddit.com/r/fatlogic/comments/ifn3o9/artist_thinks_that_being_skinny_and_japanese_isnt/g2r3rch/,Hoofwoof,"Okay so correction, Mineta would be dead of hemorrhage.",-0.5267
g2r46jk,https://www.reddit.com/r/fatlogic/comments/ifn3o9/artist_thinks_that_being_skinny_and_japanese_isnt/g2r46jk/,stnstrwbrry,"Yes but instead of dying, he gets rushed to the clinic and gets treated and the next episode it happens again. It will happen in every episode. Every episode of MHA will be Mineta having a hemorrhage in every episode becaude Momo wasn't allowed to wear revealing clothing",0.2144
g2r4iq9,https://www.reddit.com/r/fatlogic/comments/ifn3o9/artist_thinks_that_being_skinny_and_japanese_isnt/g2r4iq9/,Hoofwoof,I already hate him and I don't even know if I could watch the show if that was a running gag.  Momo wearing a mankini and a massive utility belt is all that's saving the show from Mineta.  Fuck.,-0.8625
g2r4pan,https://www.reddit.com/r/fatlogic/comments/ifn3o9/artist_thinks_that_being_skinny_and_japanese_isnt/g2r4pan/,stnstrwbrry,I want to rip his hair balls off and leave him bald while his scalp bleeds.,0.0258
g2r6hx8,https://www.reddit.com/r/fatlogic/comments/ifn3o9/artist_thinks_that_being_skinny_and_japanese_isnt/g2r6hx8/,[deleted],[removed],0.0
g2r8ymy,https://www.reddit.com/r/fatlogic/comments/ifn3o9/artist_thinks_that_being_skinny_and_japanese_isnt/g2r8ymy/,BMXTKD,"Most black people around the world don't look like that.  Most black people in the world tend to be from places that either get lots of exercise, or suffer from a lack of nutrition.      

This is pure Americacentrism, from an African American perspective.",-0.7851
g2rfch9,https://www.reddit.com/r/fatlogic/comments/ifn3o9/artist_thinks_that_being_skinny_and_japanese_isnt/g2rfch9/,sweetheartblues,"honestly, I don’t see any issue with headcanons as long as everyone respects each other’s opinions! in theory, it’s fun and sometimes comforting to project your own traits onto characters you relate to, but you can’t expect everyone else in the fandom to cater to your narrative. IDK though, I’ve never been drawn to fandom spaces.
edit: also, congrats on the novel!! good autistic/neurodivergent representation is so hard to find, so I’m always excited to see people creating it!",0.9662
g2rqeac,https://www.reddit.com/r/fatlogic/comments/ifn3o9/artist_thinks_that_being_skinny_and_japanese_isnt/g2rqeac/,red-plaid-hat,"&gt; There are very few exceptions to this, yes. 

Anime that is commercialized for the west is full of stuff like this. But, there is plenty that is just normal kids doing shit like baseball or cooking, but the west doesn't want that. There are more anime in this world than most people can imagine because a lot of it stays *home.*  


Am I saying that Japan doesn't have weird anime with huge boobs in-country? Absolutely not. They exist, but most of the content western cultures (read: not Japan) consume are large-breasted because that's what sells.",0.5509
g2rwt0p,https://www.reddit.com/r/fatlogic/comments/ifn3o9/artist_thinks_that_being_skinny_and_japanese_isnt/g2rwt0p/,Mighty_Zhdun,Thank you,0.3612
g2rx0np,https://www.reddit.com/r/fatlogic/comments/ifn3o9/artist_thinks_that_being_skinny_and_japanese_isnt/g2rx0np/,Mighty_Zhdun,"Yeah headcanons are not evil but I often find they get accepted to a degree that causes people to not get mad at the lack of representation because they've come to see x character as a member of y minority but the authors or creators get out of having to confirm anything. Also thank you for your interest in my story, I can message you about it if you'd like",0.9477
g2s6042,https://www.reddit.com/r/fatlogic/comments/ifn3o9/artist_thinks_that_being_skinny_and_japanese_isnt/g2s6042/,DerpFarce,dude momo's power is literally converting her fat into tanks and stuff. how tf these people think she's gonna be fat?,0.0
g2sa3us,https://www.reddit.com/r/fatlogic/comments/ifn3o9/artist_thinks_that_being_skinny_and_japanese_isnt/g2sa3us/,virginiarph,my problem with her is that she uses adipose to use her abilities. if that's the case then why is she stick thin? Shouldnt she be a bit bulkier to begin with?,-0.264
g2sa6ls,https://www.reddit.com/r/fatlogic/comments/ifn3o9/artist_thinks_that_being_skinny_and_japanese_isnt/g2sa6ls/,justanyusername123,"I'm pretty sure the criticism is about the insanely revealing and sexualising outfit on a teenager. Not about her being slim or Japanese. I am a big MHA fan myself and not a prude, but even I agree the re-imagined costume is much more age appropriate.",0.6908
g2saij4,https://www.reddit.com/r/fatlogic/comments/ifn3o9/artist_thinks_that_being_skinny_and_japanese_isnt/g2saij4/,justanyusername123,"Japanese anime doesn't always use real-life Japanese phenotypes (e.g. dark hair and skin). All Might himself is a Japanese man but portrayed with yellow hair and blue eyes. Like another famous Japanese hero, Sailor Moon. Anime art typically uses a variety of colours for hair, eyes and skin, that do not align with real life races. Midoriya is green haired lol. So anime characters may well have dark/black skin whilst still being Japanese, if that is their character.",0.9382
g2sije7,https://www.reddit.com/r/fatlogic/comments/ifn3o9/artist_thinks_that_being_skinny_and_japanese_isnt/g2sije7/,pruggle,Ewwww,0.0
g2smiy3,https://www.reddit.com/r/fatlogic/comments/ifn3o9/artist_thinks_that_being_skinny_and_japanese_isnt/g2smiy3/,philmarcracken,Tumblr have been doing this to japanese artists for years OP,0.0
g2sn8v5,https://www.reddit.com/r/fatlogic/comments/ifn3o9/artist_thinks_that_being_skinny_and_japanese_isnt/g2sn8v5/,Terytha,"I know, I was being a bit facetious. Most of my favorites don't have ridiculously huge boobs. ;)",0.6171
g2ssp0a,https://www.reddit.com/r/fatlogic/comments/ifn3o9/artist_thinks_that_being_skinny_and_japanese_isnt/g2ssp0a/,BlackCatLuna,"Not necessarily, very few shoujo anime feature women like that, since the primary audience is female. Tezuka's works don't feature anyone that I'd classify as half naked either.",0.3612
g2st2n7,https://www.reddit.com/r/fatlogic/comments/ifn3o9/artist_thinks_that_being_skinny_and_japanese_isnt/g2st2n7/,TheCapitalKing,"Not gonna lie the only ones I’ve watched that aren’t kids shows are Gurren Laugan, seven deadly sins, and my hero and all three of those are pretty bad about it so I just assumed",0.0772
g2svu2t,https://www.reddit.com/r/fatlogic/comments/ifn3o9/artist_thinks_that_being_skinny_and_japanese_isnt/g2svu2t/,BlackCatLuna,"I see, they're primarily aimed at men so that makes sense.

Oh! Overlord might be a good one for you then. You're watching the nation character descend into villainy but for the most part the girls are well dressed.",0.3802
g2sw4em,https://www.reddit.com/r/fatlogic/comments/ifn3o9/artist_thinks_that_being_skinny_and_japanese_isnt/g2sw4em/,thebluef0x,"To be fair Momo is kinda oversexualized and I think the anime would be much better if they changed it to something more normal or creative like the other suits.

I don't accept that ""Oh it's because her quirk"" bs",0.8262
g2t17ou,https://www.reddit.com/r/fatlogic/comments/ifn3o9/artist_thinks_that_being_skinny_and_japanese_isnt/g2t17ou/,darium4,"So I’ve seen some of this artists other stuff that’s plastered with “stop sexualizing women” and whether or not it’s a parody account, it really bothers me that their way of not sexualizing women is making them obese and covered in body hair. 

A more modest look is absolutely the way to go if that’s the goal or even an outfit that is still revealing but more tasteful. A woman being thin isn’t her being sexualized. Tf kind of logic is that. And same goes for the inverse. Overweight women can be and are absolutely sexualized as well.",-0.1903
g2tcyno,https://www.reddit.com/r/fatlogic/comments/ifn3o9/artist_thinks_that_being_skinny_and_japanese_isnt/g2tcyno/,Soulsaversara,Obviously the redraw is awful but I am not a big fan of the original costume and her superpower does needs less clothing but it could have been shorts and a crop top rather than a boob split,0.1796
g2u928y,https://www.reddit.com/r/fatlogic/comments/ifn3o9/artist_thinks_that_being_skinny_and_japanese_isnt/g2u928y/,Trovaa,"not only is it pointless and ignorant to complain about the sexualization of her (albeit more understandable) why would they make her look like this when it goes against the entire point of her quirk and where the anime is set

if anything i've seen more people built like momo at my school than the redrawn one.",0.1689
g2up2ol,https://www.reddit.com/r/fatlogic/comments/ifn3o9/artist_thinks_that_being_skinny_and_japanese_isnt/g2up2ol/,BMXTKD,Here's a realistic body they can show.  A muscular male with a decent amount of body fat.,0.0
g2upgfw,https://www.reddit.com/r/fatlogic/comments/ifn3o9/artist_thinks_that_being_skinny_and_japanese_isnt/g2upgfw/,Terytha,"There's some of that but also realistically, people who train to be heroes would be pretty ripped.",0.8674
g2v6q0x,https://www.reddit.com/r/fatlogic/comments/ifn3o9/artist_thinks_that_being_skinny_and_japanese_isnt/g2v6q0x/,RandomBRguy089,"If this person had read the manga or watch the anime (I bet my ass he/she did neither), he/she would know that:

1 - Momo creates things out of her skin. For that reason, she dresses like this.

2 - To create things, Momo uses her body fat. Many theorize this is the reason for her being slim despite eating a lot.",0.296
g2wfo6p,https://www.reddit.com/r/fatlogic/comments/ifn3o9/artist_thinks_that_being_skinny_and_japanese_isnt/g2wfo6p/,Reddysharkyboi,"But she's a superhero who burns calories so much by using her power.

 She literally has to eat alot because she needs the energy to create something. 

Also she's a 15-16 year old girl who does a lot of exercise.

 Her body type is pretty realistic,


 maybe she should look more muscular though.",0.8625
g2wfsma,https://www.reddit.com/r/fatlogic/comments/ifn3o9/artist_thinks_that_being_skinny_and_japanese_isnt/g2wfsma/,Reddysharkyboi,"They changed some of the body types skinnier in the anime. Uraraka is kinda chubby in the manga, in a cute way, but they changed that in the anime.",0.25
g3ln7pw,https://www.reddit.com/r/fatlogic/comments/ifn3o9/artist_thinks_that_being_skinny_and_japanese_isnt/g3ln7pw/,Danarky,"Gurren Lagann is literally one of the best anime. And if you're referring to Yoko, you entirely missed the point of her character.

Kamina is shirtless half the time but I don't see people throwing a fit about that",0.6253
g3n1lh6,https://www.reddit.com/r/fatlogic/comments/ifn3o9/artist_thinks_that_being_skinny_and_japanese_isnt/g3n1lh6/,TheCapitalKing,Yeah I liked it a ton. The difference between Kamina and Yoko was that they never did extended close ups on his chest and ass,0.128
g3n36oh,https://www.reddit.com/r/fatlogic/comments/ifn3o9/artist_thinks_that_being_skinny_and_japanese_isnt/g3n36oh/,[deleted],[deleted],0.0
g5dhv05,https://www.reddit.com/r/fatlogic/comments/ifn3o9/artist_thinks_that_being_skinny_and_japanese_isnt/g5dhv05/,CrabOutOfTheBucket,"&gt; implying that black people are the more “ethical” race.

Way to infantilize an entire group of people.

&gt; makes them black when trying to make the characters less conventionally attractive.

Way to imply that the group of people you infantilized are ugly too.",-0.1725
gdnh6tb,https://www.reddit.com/r/fatlogic/comments/ifn3o9/artist_thinks_that_being_skinny_and_japanese_isnt/gdnh6tb/,Mr-back-pain,She needs exposed skin to use her power in the first place so her uniform makes sense,-0.0772
