giij3o3,https://www.reddit.com/r/dataisbeautiful/comments/kswcrt/oc_the_racial_wealth_gap_in_america/giij3o3/,preitylo,"Created Using [Tableau](https://public.tableau.com/profile/preethilo#!/vizhome/TheRacialWealthGap_16095587325150/RacialWealthGap) and [data source](https://www.federalreserve.gov/econres/scf/dataviz/scf/table/#series:Net_Worth;demographic:racecl4;population:all;units:median):   U.S. Federal Reserve Board, Survey of Consumer Finances (SCF)",0.3164
giijaa0,https://www.reddit.com/r/dataisbeautiful/comments/kswcrt/oc_the_racial_wealth_gap_in_america/giijaa0/,[deleted],[removed],0.0
giijhqf,https://www.reddit.com/r/dataisbeautiful/comments/kswcrt/oc_the_racial_wealth_gap_in_america/giijhqf/,daddysash,"Any reason the ""Other"" category is so broad? Even just grouping ""Asian"" includes Arab, Indian, Chinese, Korean, Japanese, Fililipino etc.",0.0
giijtru,https://www.reddit.com/r/dataisbeautiful/comments/kswcrt/oc_the_racial_wealth_gap_in_america/giijtru/,preitylo,"The survey of consumer finance by federal reserve board dataset breaks down the data by race and ethnicity to be in these categories ( White, Black, Hispanic and Other).",0.0
giilotv,https://www.reddit.com/r/dataisbeautiful/comments/kswcrt/oc_the_racial_wealth_gap_in_america/giilotv/,crazy_dude360,"Wow. Way to obfuscate results there.

Not calling op out. But the source.

Would love to see the finer breakdowns... Are they open for a foia request?",0.8481
giilxrq,https://www.reddit.com/r/dataisbeautiful/comments/kswcrt/oc_the_racial_wealth_gap_in_america/giilxrq/,[deleted],[removed],0.0
giin084,https://www.reddit.com/r/dataisbeautiful/comments/kswcrt/oc_the_racial_wealth_gap_in_america/giin084/,[deleted],[removed],0.0
giiodaj,https://www.reddit.com/r/dataisbeautiful/comments/kswcrt/oc_the_racial_wealth_gap_in_america/giiodaj/,dataisbeautiful-bot,"Thank you for your [Original Content](https://www.reddit.com/r/dataisbeautiful/wiki/rules/rule3), /u/preitylo!  
**Here is some important information about this post:**

* [View the author's citations](https://www.reddit.com/r/dataisbeautiful/comments/kswcrt/oc_the_racial_wealth_gap_in_america/giij3o3/)

* [View other OC posts by this author](https://www.reddit.com/r/dataisbeautiful/search?q=author%3A""preitylo""+title%3AOC&amp;sort=new&amp;include_over_18=on&amp;restrict_sr=on)

Remember that all visualizations on r/DataIsBeautiful should be viewed with a healthy dose of skepticism. If you see a potential issue or oversight in the visualization, please post a constructive comment below. Post approval does not signify that this visualization has been verified or its sources checked.

[Join the Discord Community](https://discord.gg/NRnrWE7)

Not satisfied with this visual? Think you can do better? [Remix this visual](https://www.reddit.com/r/dataisbeautiful/wiki/rules/rule3#wiki_remixing) with the data in the author's citation.

---

^^[I'm&amp;nbsp;open&amp;nbsp;source](https://github.com/r-dataisbeautiful/dataisbeautiful-bot)&amp;nbsp;|&amp;nbsp;[How&amp;nbsp;I&amp;nbsp;work](https://www.reddit.com/r/dataisbeautiful/wiki/flair#wiki_oc_flair)",0.9118
giipg9m,https://www.reddit.com/r/dataisbeautiful/comments/kswcrt/oc_the_racial_wealth_gap_in_america/giipg9m/,dldmusic,"Shouldn't that data always be paired with the population.   
For example  
there are 1 million green people, 700 thousand purple.   
Wouldn't it make sense that there are more green people with higher wealth?",0.4939
giipshy,https://www.reddit.com/r/dataisbeautiful/comments/kswcrt/oc_the_racial_wealth_gap_in_america/giipshy/,VistaDogg,"Both median and mean both show data about the populations as whole units, and so do not skew for proportional differences, so no.",0.0
giirast,https://www.reddit.com/r/dataisbeautiful/comments/kswcrt/oc_the_racial_wealth_gap_in_america/giirast/,daddysash,"A bit suspect by the survey. 

I imagine if you included ""Asian"" as a group they would be comparable to the White group in terms of wealth. And the Native American, Alaskan etc. group would rank quite lowly.",-0.0754
giitzlj,https://www.reddit.com/r/dataisbeautiful/comments/kswcrt/oc_the_racial_wealth_gap_in_america/giitzlj/,winterxisxcoming,I wonder if slavery had anything to do with this?,-0.7003
giivh2k,https://www.reddit.com/r/dataisbeautiful/comments/kswcrt/oc_the_racial_wealth_gap_in_america/giivh2k/,spud_gun04,"Yep, the source is sus, so the representation would be sus as well. Not OP's fault but still something to be aware of.",0.4174
giivlm8,https://www.reddit.com/r/dataisbeautiful/comments/kswcrt/oc_the_racial_wealth_gap_in_america/giivlm8/,Tallbirdae,"Not really. It's more that ethnic majorities tend to have more opportunities than ethnic minorities, because people have an unconscious bias towards people who are like them.",0.6115
giiwia1,https://www.reddit.com/r/dataisbeautiful/comments/kswcrt/oc_the_racial_wealth_gap_in_america/giiwia1/,[deleted],[deleted],0.0
giizdim,https://www.reddit.com/r/dataisbeautiful/comments/kswcrt/oc_the_racial_wealth_gap_in_america/giizdim/,Swissaliciouse,What always baffles me with such income and net worth data is the huge difference between average and median. Just amazing if you start thinking about it.,0.7906
gij0ow9,https://www.reddit.com/r/dataisbeautiful/comments/kswcrt/oc_the_racial_wealth_gap_in_america/gij0ow9/,rammo123,Yes you can trace generational inequality that far back. Plus add Jim Crow and the GI Bill.,0.4019
gij0pop,https://www.reddit.com/r/dataisbeautiful/comments/kswcrt/oc_the_racial_wealth_gap_in_america/gij0pop/,rammo123,(Jews are white),0.0
gij0way,https://www.reddit.com/r/dataisbeautiful/comments/kswcrt/oc_the_racial_wealth_gap_in_america/gij0way/,[deleted],[deleted],0.0
gij14al,https://www.reddit.com/r/dataisbeautiful/comments/kswcrt/oc_the_racial_wealth_gap_in_america/gij14al/,OnTopOfTheBellCurve,"For Econ nerds:
Focusing on blacks and whites mostly, income differences are way smaller than wealth differences. In principle, this could be surprising (if in average a white family earns only twice as much, why would it be 8 times wealthier?). 

There is a nice article by Ashman and Neumuller (RED, 2020) showing that observed income differences are consistent with the Racial Wealth Gap. This implies that the best way of fighting racial wealth inequality is by addressing the sources of income inequality!",0.9622
gij2e3e,https://www.reddit.com/r/dataisbeautiful/comments/kswcrt/oc_the_racial_wealth_gap_in_america/gij2e3e/,AayushShah141,"According to US census, Jews are white. Even Yemeni ppl are white. Don’t ask me why.",0.0
gij2h2g,https://www.reddit.com/r/dataisbeautiful/comments/kswcrt/oc_the_racial_wealth_gap_in_america/gij2h2g/,Cute_Set_2680,Over 90% of Jews in the US are Ashkenazi and have north/north-east European origins while in Israel less than 50% do. So the racial makeup of Jews in both countries is quite different. And I find it hard to imagine that anyone could classify most Ashkenazi as “non-white”.,-0.1027
gij2j4g,https://www.reddit.com/r/dataisbeautiful/comments/kswcrt/oc_the_racial_wealth_gap_in_america/gij2j4g/,rammo123,Oh you're one of *those* people.,0.0
gij2lck,https://www.reddit.com/r/dataisbeautiful/comments/kswcrt/oc_the_racial_wealth_gap_in_america/gij2lck/,[deleted],[deleted],0.0
gij2raa,https://www.reddit.com/r/dataisbeautiful/comments/kswcrt/oc_the_racial_wealth_gap_in_america/gij2raa/,[deleted],[deleted],0.0
gij2zkp,https://www.reddit.com/r/dataisbeautiful/comments/kswcrt/oc_the_racial_wealth_gap_in_america/gij2zkp/,[deleted],[deleted],0.0
gijahe7,https://www.reddit.com/r/dataisbeautiful/comments/kswcrt/oc_the_racial_wealth_gap_in_america/gijahe7/,Reginald_III,"If this is to compare races, might want to correct for the super wealthy. White numbers would come way down. 

While there is certainly systemic racism that has caused black and Hispanic poverty, a much more pressing issue, and where the clear statistical gap seen in this data set originates, is the wealth and power of the super wealthy. 

If we only focus on race we miss the opportunity to unite as the working class.",0.9337
gijd64k,https://www.reddit.com/r/dataisbeautiful/comments/kswcrt/oc_the_racial_wealth_gap_in_america/gijd64k/,SoManyHamboigahs,"Whites and asians also typically have smaller families, which increases their wealth per family.",0.4939
gijdm0t,https://www.reddit.com/r/dataisbeautiful/comments/kswcrt/oc_the_racial_wealth_gap_in_america/gijdm0t/,DragonDimos,"Why are Americans so fixated on race? As a greek, my predominant theory is that they want to see the difference in statistics to blame things like racism and not the real culprit that is the cultural tribalism (hood culture) that exists in areas with more black population than not. That in combination to the lack of mixing from the different communities that have formed. What I also hate is that even the label white is just problematic as there is no white race, there is indo european race.",-0.93
gije4jn,https://www.reddit.com/r/dataisbeautiful/comments/kswcrt/oc_the_racial_wealth_gap_in_america/gije4jn/,DragonDimos,"It's not like white is a race, the race is indo europeans that includes arabs and Indians.",-0.2755
gijef30,https://www.reddit.com/r/dataisbeautiful/comments/kswcrt/oc_the_racial_wealth_gap_in_america/gijef30/,DragonDimos,"The best way of fighting racial inequality is to forcefully remove the hood culture from the black communities. If it was really racism, then the asians wouldn't be the richest. Also white shouldn't be a race, the race is indo european.",-0.6672
gijek5g,https://www.reddit.com/r/dataisbeautiful/comments/kswcrt/oc_the_racial_wealth_gap_in_america/gijek5g/,DragonDimos,"Well, the asians are richer than the ""whites""(should be indo europeans that actually is a race but ok), this just shows that racism isn't the culprit, it's different less productive and innovative cultures that are heavily tied to a race. (Hood culture the biggest example).",-0.1143
gijh9ww,https://www.reddit.com/r/dataisbeautiful/comments/kswcrt/oc_the_racial_wealth_gap_in_america/gijh9ww/,Better-W-Bacon,The uber rich cause this. Billionaires.,0.5984
gijlan5,https://www.reddit.com/r/dataisbeautiful/comments/kswcrt/oc_the_racial_wealth_gap_in_america/gijlan5/,bam1444,"What word would you used, instead or race/racial, to qualify the separation between ""White"", ""Arabs"", ""Indians"", ""Black"", etc.?

I'm genuinely curious because I think that this division is relevant when studying wealth gap because wealth (and many other things) was and still is impacted by this division (because of many factors like ideology...).

Also, would you call discrimination from white people againt arabs ""racism"" or not?",0.755
gijnxw0,https://www.reddit.com/r/dataisbeautiful/comments/kswcrt/oc_the_racial_wealth_gap_in_america/gijnxw0/,mixmatch314,"What a privilege to be able to conveniently ignore the impact of hundreds of years of slavery, Jim crow, and other forms of systematic racism.",-0.872
gijva12,https://www.reddit.com/r/dataisbeautiful/comments/kswcrt/oc_the_racial_wealth_gap_in_america/gijva12/,Dr_Longfellow_Deeds,"&gt;In principle, this could be surprising (if in average a white family earns only twice as much, why would it be 8 times wealthier?).

How many children does the average black and white families have?

How many black and white family households are dual income vs single income?

I think that should explain most if not all the discrepancy.",0.7041
gijvqsp,https://www.reddit.com/r/dataisbeautiful/comments/kswcrt/oc_the_racial_wealth_gap_in_america/gijvqsp/,Dr_Longfellow_Deeds,"If you can have have white skin and be Hispanic (or ""white Hispanic""), then I see no reason why I can't have white skin and be Jewish (or ""white Jewish""). Then non-hispanic white can be non-hispanic, non-jewish white.",-0.296
gijvxnu,https://www.reddit.com/r/dataisbeautiful/comments/kswcrt/oc_the_racial_wealth_gap_in_america/gijvxnu/,Dr_Longfellow_Deeds,Vehicle differences are easily explained. Whites live in rural areas which require cars. Blacks live in rural areas and rely on public transportation.,0.34
gijx0bi,https://www.reddit.com/r/dataisbeautiful/comments/kswcrt/oc_the_racial_wealth_gap_in_america/gijx0bi/,daddysash,Is a family in this dataset a set of parents and children or the inhabitants of a household?,0.0
gijyk3h,https://www.reddit.com/r/dataisbeautiful/comments/kswcrt/oc_the_racial_wealth_gap_in_america/gijyk3h/,shmerham,Except underserved urban areas tend to have poor access to public transit.,-0.4767
gik2ad7,https://www.reddit.com/r/dataisbeautiful/comments/kswcrt/oc_the_racial_wealth_gap_in_america/gik2ad7/,Dr_Longfellow_Deeds,"What does ""undeserved urban area"" mean? I've never heard that term.",0.0
gik6fj9,https://www.reddit.com/r/dataisbeautiful/comments/kswcrt/oc_the_racial_wealth_gap_in_america/gik6fj9/,AlwaysBamboozled,To keep pushing the idea that white people are the only ones who prosper and everyone else is oppressed,-0.4767
gikch0w,https://www.reddit.com/r/dataisbeautiful/comments/kswcrt/oc_the_racial_wealth_gap_in_america/gikch0w/,Cyrthazil,"They are Ethnic groups. We refer to various ethnicities.

 Any prejudice against anyone, if racially motivated, is racism by definition.",-0.6597
gikcnhe,https://www.reddit.com/r/dataisbeautiful/comments/kswcrt/oc_the_racial_wealth_gap_in_america/gikcnhe/,Cyrthazil,No. A thing cannot be it's own cause.,0.0
gikctcl,https://www.reddit.com/r/dataisbeautiful/comments/kswcrt/oc_the_racial_wealth_gap_in_america/gikctcl/,Cyrthazil,"Wealth follows a ""Pareto"" distribution, not a ""standard"" distribution.

It is entirely natural, and probably quite desirable.",0.8218
gikdm85,https://www.reddit.com/r/dataisbeautiful/comments/kswcrt/oc_the_racial_wealth_gap_in_america/gikdm85/,Cyrthazil,"There is no way to ""correct"" for the natural distribution of wealth. It follows a Pareto distribution, not a standard distribution.

However, you can look at median values instead of mean averages for your purposes",0.7351
gikdw1r,https://www.reddit.com/r/dataisbeautiful/comments/kswcrt/oc_the_racial_wealth_gap_in_america/gikdw1r/,Cyrthazil,"proportionally, no.

all figures are averages, thus, per capita.",0.0
gikf912,https://www.reddit.com/r/dataisbeautiful/comments/kswcrt/oc_the_racial_wealth_gap_in_america/gikf912/,Cyrthazil,"Small correction:

A subheading near the top says ""White families have a median net worth that is almost 8x higher than Black households and 5x higher than Hispanic households.""

In both occurrences of the phrase ""higher than"", it should instead be written ""as high as"".

Reason:  
8x higher = 9x as high as  
5x higher = 6x as high as  
60% more = 160% of  
160% more = 260% of  
etc.",0.4019
gikffod,https://www.reddit.com/r/dataisbeautiful/comments/kswcrt/oc_the_racial_wealth_gap_in_america/gikffod/,Reginald_III,I think you're over thinking my point. Segregate out the data for those whose wealth is staggering. That would lower both the median and mean stealth of white people allowing a better comparison between races.  You wouldn't need to do any advanced statistical correction based on distributions.,0.6808
gikfyib,https://www.reddit.com/r/dataisbeautiful/comments/kswcrt/oc_the_racial_wealth_gap_in_america/gikfyib/,Swissaliciouse,":-) Not sure what's 'natural' about that - but yes it is something frequently observed. However, without having thought that through too carefully - the difference between median and the average could be proportional to the Gini coefficient. A Gini-coeff. of one corresponds to a median = average. 

Just made my brain hurt at this time of the day. Need some rest :-).",-0.1744
gikhani,https://www.reddit.com/r/dataisbeautiful/comments/kswcrt/oc_the_racial_wealth_gap_in_america/gikhani/,[deleted],[removed],0.0
gikkkti,https://www.reddit.com/r/dataisbeautiful/comments/kswcrt/oc_the_racial_wealth_gap_in_america/gikkkti/,Cyrthazil,"How does the median not already do that? Do you know how the median is calculated?

Edit: Median would not decrease as you suggest. It would be virtually unaffected.",0.0
gikkn2d,https://www.reddit.com/r/dataisbeautiful/comments/kswcrt/oc_the_racial_wealth_gap_in_america/gikkn2d/,kraz_drack,Well I mean neither is Hispanic...,0.2732
gikllps,https://www.reddit.com/r/dataisbeautiful/comments/kswcrt/oc_the_racial_wealth_gap_in_america/gikllps/,shmerham,"Are you black and living in the US now?

If not, why are you more qualified to understand racial disparities in the US than people who live here and see it, research it, and/or suffer from it.",-0.5423
gikm67m,https://www.reddit.com/r/dataisbeautiful/comments/kswcrt/oc_the_racial_wealth_gap_in_america/gikm67m/,bam1444,"Yeah, I expected this answer ha ha",0.7184
gikmk2o,https://www.reddit.com/r/dataisbeautiful/comments/kswcrt/oc_the_racial_wealth_gap_in_america/gikmk2o/,Civilian76,Because race is the only thing that keeps our entire population at odds with one another and the powers that be in this nation know it and exploit it daily.,-0.1027
gikmz4n,https://www.reddit.com/r/dataisbeautiful/comments/kswcrt/oc_the_racial_wealth_gap_in_america/gikmz4n/,Civilian76,Sort of like the privilege to be able to constantly fall back on those archaic days as a scapegoat to explain why your lot in life is worse than others and how it’s somebody else’s fault why your life is the way it is?,-0.5423
gikmzm8,https://www.reddit.com/r/dataisbeautiful/comments/kswcrt/oc_the_racial_wealth_gap_in_america/gikmzm8/,shmerham,"Areas lacking in critical services (medical services, grocery stores, transit, etc).  It's no surprise that these tend to be areas that have larger minority populations.  Sadly, the areas that need transit the most, are somtimes the ones that don't have it.  Someone with low income is forced to buy a car or live somewhere more expensive.

[https://philly.curbed.com/2018/2/8/16984694/philadelphia-transportation-underserved-neighborhoods-map](https://philly.curbed.com/2018/2/8/16984694/philadelphia-transportation-underserved-neighborhoods-map)",-0.8754
giknhx6,https://www.reddit.com/r/dataisbeautiful/comments/kswcrt/oc_the_racial_wealth_gap_in_america/giknhx6/,Civilian76,Are we talking about the slave trade of the 1800s or are we talking about the modern slavery of government handout programs that betray any sense of self betterment or entrepreneurship in black communities?,-0.875
giknj8p,https://www.reddit.com/r/dataisbeautiful/comments/kswcrt/oc_the_racial_wealth_gap_in_america/giknj8p/,Dr_Longfellow_Deeds,"Oh, I misread. I thought you wrote undeserved and not underserved. Yeah, underserved makes much more sense.",-0.4567
giknrjs,https://www.reddit.com/r/dataisbeautiful/comments/kswcrt/oc_the_racial_wealth_gap_in_america/giknrjs/,mixmatch314,"Archaic implies that it is in the past, but the reality is that it is ingrained in the system that currently govern our society. If you don't see that, you simply are not looking.",0.0
gikoe7x,https://www.reddit.com/r/dataisbeautiful/comments/kswcrt/oc_the_racial_wealth_gap_in_america/gikoe7x/,Civilian76,"I see what you’re talking about daily. Inner city black communities are in a perpetual state of squaller and disrepair because of the lack of self worth and ambition instilled from decades of government handout programs. I’ll agree with you on the modern day slavery, but any runoff of the 1800s slave days ended in the 60s.",-0.3291
gikohep,https://www.reddit.com/r/dataisbeautiful/comments/kswcrt/oc_the_racial_wealth_gap_in_america/gikohep/,Reginald_III,"It would go down a small amount, granted. But it would go down. 

Now that you got that pedantic point aside. Do you agree the data can be corrected and if it were corrected for the uber wealthy, the data would better reflect the difference between black, white and Hispanic populations?",0.906
gikptc1,https://www.reddit.com/r/dataisbeautiful/comments/kswcrt/oc_the_racial_wealth_gap_in_america/gikptc1/,mixmatch314,"I feel for you and whatever experience you have been through that makes it so that you cannot help but denigrate others, nor see the racist nature of your expressed point of view. Consider mindfulness as an alternative to the emotional turmoil you are experiencing around this topic, not just to have a more positive impact on those who you come into contact with, but also for you own inner health. Mindful of Race, by Ruth King is an excellent starting point if you want to understand your own reactions to this topic and the effect that you are having.",0.9348
gikqhrc,https://www.reddit.com/r/dataisbeautiful/comments/kswcrt/oc_the_racial_wealth_gap_in_america/gikqhrc/,shmerham,"I recommend talking to some people that are black that grew up in the suburbs.  Ask them if they had the same opportunities as their white neighbors since their parents ""forcefully removed"" them from hood culture.",0.6249
gikqm2g,https://www.reddit.com/r/dataisbeautiful/comments/kswcrt/oc_the_racial_wealth_gap_in_america/gikqm2g/,Civilian76,And the sorrow felt for lack of understanding or even intelligence in regard to a world view works both ways. Your inability to reconcile the facts I have laid before you speaks volumes to the fact that further discussion on this topic with you holds zero worth. I can only hope that you are more receptive o the idea that not everyone sees things as you do. Good luck in your future endeavors.,0.6597
gikrfzr,https://www.reddit.com/r/dataisbeautiful/comments/kswcrt/oc_the_racial_wealth_gap_in_america/gikrfzr/,mixmatch314,"If oppressed minorities were truly exploiting the system, the graphic presented by OP would reflect that, but it does not. You have not presented any facts supported by reality. Feeling justified in hatred does not change the reality that you are living with hate and spitefulness, and that is not a productive or beneficial state of existence.",-0.7227
gil0667,https://www.reddit.com/r/dataisbeautiful/comments/kswcrt/oc_the_racial_wealth_gap_in_america/gil0667/,insearch-ofknowledge,"The reason why white people do better is the passing of wealth and better access to education from generation to generation and that minorities such as black Americans do not have that passing of wealth from generations but maybe only recently some percentage of black people do so now. The others group is wide but I imagine the first generations of those were not slaves and could work hard to help the next generation get good education or take over an existing established business. I see that in Asians including Chinese, Vietnamese, Indians, Pakistani and Arabs. I might be wrong but this is my thoughts.",0.8294
gil1bh6,https://www.reddit.com/r/dataisbeautiful/comments/kswcrt/oc_the_racial_wealth_gap_in_america/gil1bh6/,shmerham,"2.3 children per household for white vs 2.5 for black 

https://www.pewsocialtrends.org/2015/05/07/family-size-among-mothers/

58% of white households are dual income vs 61% of black households 

https://www.bls.gov/opub/mlr/2020/article/comparing-characteristics-and-selected-expenditures-of-dual-and-single-income-households-with-children.htm",0.0
gil4w3t,https://www.reddit.com/r/dataisbeautiful/comments/kswcrt/oc_the_racial_wealth_gap_in_america/gil4w3t/,OnTopOfTheBellCurve,Hey! The article I mentioned controls for race differentials in marriage/divorce rates. Yours is a good point regardless; I think numbers posted above are convincing though.,0.7088
gilafb2,https://www.reddit.com/r/dataisbeautiful/comments/kswcrt/oc_the_racial_wealth_gap_in_america/gilafb2/,bobthantos,"You're basically saying ""black people are poor because they choose to be"", which is very dumb. It's also strange that being Greek gave you that theory.  


The main issue is less funding going to the areas that need it most. This results in lesser education, jobs that don't pay as much, and poverty. What happens when you get all of that? Crime goes up, giving you your ""hood culture"" that, according to you, blacks strive for. Why do predominately black communities fall into this? No way it can be institutional racism, right? They choose that lifestyle, because they're black! lol -- nice theory",-0.9374
gilgm4w,https://www.reddit.com/r/dataisbeautiful/comments/kswcrt/oc_the_racial_wealth_gap_in_america/gilgm4w/,lovepuppy31,Looks like asians are some fairytale mythical group that doesn't exist,0.3612
gilje86,https://www.reddit.com/r/dataisbeautiful/comments/kswcrt/oc_the_racial_wealth_gap_in_america/gilje86/,thing-3456,I mean that’s always been the problem lower income -&gt; more crime this isn’t just from america this is a trend in most countries where a group is overrepresented in crime,-0.9041
giljrou,https://www.reddit.com/r/dataisbeautiful/comments/kswcrt/oc_the_racial_wealth_gap_in_america/giljrou/,Cattlegod,17% or 1/6 of whites have some type of company ownership?  That seems nuts!  I would have never thought it was even close to that by a mile.,-0.3802
