1394823277168656387,https://twitter.com/mainlinezine/status/1394823277168656387,mainlinezine,"More policing and more jails have already proven to be ineffective solutions to decreasing crime and making our communities safe. It’s time for new solutions, like funding community programs, addressing root causes of crime, and enacting real anti-poverty policy in the city. /7",-0.1779
1394823278435311620,https://twitter.com/mainlinezine/status/1394823278435311620,mainlinezine,"It’s also time to elect authentically progressive candidates into local office who will bring new solutions to the table, not accept toxic $ from police unions, &amp; not cave in the face of law and order/tough on crime stances which are sure to run rampant this election season. /8",-0.3987
1394823275943895041,https://twitter.com/mainlinezine/status/1394823275943895041,mainlinezine,The police killings of Oscar Cain &amp; Jimmy Atchison (both in 2019) are among the cases in the exhaustive backlog Willis decries &amp; insists more policing will help solve. She’s also continued to try to recuse herself from difficult cases involving police brutality &amp; shootings. /6,-0.8288
1394823274740150273,https://twitter.com/mainlinezine/status/1394823274740150273,mainlinezine,"While Willis decries the criminal justice system’s issue of perpetual backlog, she fails to recognize that the APD are regular contributors to this backlog through their own acts of state sanctioned gun violence and other forms of misconduct. /5",-0.8519
1394823273439891456,https://twitter.com/mainlinezine/status/1394823273439891456,mainlinezine,"Yesterday's report from @ajc didn't do much except to echo a recent Facebook post by Willis that displayed incendiary calls to embolden a police system that is already set to receive 10% increase in the city budget, more officers, &amp; more surveillance. /4\n\nhttps://t.co/OlTjnmHJdG",0.3182
1394823271992889345,https://twitter.com/mainlinezine/status/1394823271992889345,mainlinezine,We fact-checked Willis’ campaign finance reports &amp; cross-referenced w/ an account provided by former progressive FCDA candidate Christian Wise Smith. Hear about his meeting w/ Willis &amp; T.I. following last year’s primary in an interview here. (26:52) /3\n\nhttps://t.co/KWaitrn0m7,0.4767
1394823270575132673,https://twitter.com/mainlinezine/status/1394823270575132673,mainlinezine,"This important detail is a fact that the @ajc continues to ignore or omit from their reports on the new DA. We’ve reported on this numerous times, as in the most recent available updates regarding the Brooks, Pilgrim, &amp; Young police brutality cases. /2\n\nhttps://t.co/l0gjPStL1d",-0.6908
1394823269098737667,https://twitter.com/mainlinezine/status/1394823269098737667,mainlinezine,"Friendly reminder that Fulton County DA Fani Willis was endorsed &amp; funded by the International Brotherhood of Police &amp; Mary Norwood, so she probably doesn’t have the most reliable outlook on how we should address crime in our city. @ajc /1\n\nhttps://t.co/mHfYmxl7TS",0.1779
