gr3fwhd,https://www.reddit.com/r/iamatotalpieceofshit/comments/m5l1oz/a_lot_of_racism_suicide_encouragement_and_hate/gr3fwhd/,Pete0970,"Ah, yes. anomity on the internet. First, you go from being all open about your ideas and speak freely as you like because you aren't worried about anyone judging you, then someone starts being annoying to you, and you can litterally whip out the cruelest words you can imagine, hoping you'd beat them in an argument. You get more and more toxic as time goes buy, untill you get something like this. Pure basement dwelling stinky ass teen that probably uses 4chan.

But tbh tho, 2020 me would have loved to turn into the Elephant's Foot if someone just mildly pissed me off in a video game, but I had to slam the brakes there because my real name is in my username, and Id probably get my ass recorded and have the video haunt me 10 years down the line, so nah. I'll just be chill.",-0.9398
gr3gu89,https://www.reddit.com/r/iamatotalpieceofshit/comments/m5l1oz/a_lot_of_racism_suicide_encouragement_and_hate/gr3gu89/,thefoxishere16,Why didn’t you just quit the game,0.0
gr3hyg6,https://www.reddit.com/r/iamatotalpieceofshit/comments/m5l1oz/a_lot_of_racism_suicide_encouragement_and_hate/gr3hyg6/,[deleted],[removed],0.0
gr3m7ur,https://www.reddit.com/r/iamatotalpieceofshit/comments/m5l1oz/a_lot_of_racism_suicide_encouragement_and_hate/gr3m7ur/,AshfordTN_Backup,Oh wait it's ranked :),0.4588
gr3md6m,https://www.reddit.com/r/iamatotalpieceofshit/comments/m5l1oz/a_lot_of_racism_suicide_encouragement_and_hate/gr3md6m/,AshfordTN_Backup,"It was an accidental kill, a run away from a fight just happened to enter the house I'm looting, he has 4 hp so not gonna say no to that lmao",-0.4238
gr3mg21,https://www.reddit.com/r/iamatotalpieceofshit/comments/m5l1oz/a_lot_of_racism_suicide_encouragement_and_hate/gr3mg21/,[deleted],[removed],0.0
gr3mk75,https://www.reddit.com/r/iamatotalpieceofshit/comments/m5l1oz/a_lot_of_racism_suicide_encouragement_and_hate/gr3mk75/,Kosmological,"It does hurt people’s feelings and there is nothing wrong with that. What this person is saying is fucking vile. It could really fuck with someone who’s already struggling and having a bad day. These people saying this disgusting vile shit need to be shamed, banned, and have their internet privileges taken away until they get their shit straightened the fuck out.",-0.9907
gr3mr2t,https://www.reddit.com/r/iamatotalpieceofshit/comments/m5l1oz/a_lot_of_racism_suicide_encouragement_and_hate/gr3mr2t/,thefoxishere16,"So it matters more than your own comfort level?
It’s just a game.",0.4364
gr3mwel,https://www.reddit.com/r/iamatotalpieceofshit/comments/m5l1oz/a_lot_of_racism_suicide_encouragement_and_hate/gr3mwel/,AshfordTN_Backup,Did I mention anywhere in my title that I'm pissed or uncomfortable? I ain't trying to be a victim I honestly don't give a fuck about most of his words I just shared it cuz it's suitable for this subreddit,-0.1655
gr3nbqu,https://www.reddit.com/r/iamatotalpieceofshit/comments/m5l1oz/a_lot_of_racism_suicide_encouragement_and_hate/gr3nbqu/,chokwitsyum,"This is what people do in online chat, so you need to be mentally prepared for it",0.2263
gr3nmt2,https://www.reddit.com/r/iamatotalpieceofshit/comments/m5l1oz/a_lot_of_racism_suicide_encouragement_and_hate/gr3nmt2/,[deleted],[removed],0.0
gr3rouc,https://www.reddit.com/r/iamatotalpieceofshit/comments/m5l1oz/a_lot_of_racism_suicide_encouragement_and_hate/gr3rouc/,AggressiveNoodles,I just kinda feel bad. I think he is just really sad and not doing okay in his life :((,-0.8064
gr3t5dg,https://www.reddit.com/r/iamatotalpieceofshit/comments/m5l1oz/a_lot_of_racism_suicide_encouragement_and_hate/gr3t5dg/,Ye_olde_oak_store,Isn't diamond where boosting happens normally?,-0.4717
gr3u1y4,https://www.reddit.com/r/iamatotalpieceofshit/comments/m5l1oz/a_lot_of_racism_suicide_encouragement_and_hate/gr3u1y4/,typewriter45,the Geometry dash guy?,0.0
gr3w1yx,https://www.reddit.com/r/iamatotalpieceofshit/comments/m5l1oz/a_lot_of_racism_suicide_encouragement_and_hate/gr3w1yx/,jadelemental,They were being dicks.,0.0
gr3xm43,https://www.reddit.com/r/iamatotalpieceofshit/comments/m5l1oz/a_lot_of_racism_suicide_encouragement_and_hate/gr3xm43/,[deleted],[removed],0.0
gr42zum,https://www.reddit.com/r/iamatotalpieceofshit/comments/m5l1oz/a_lot_of_racism_suicide_encouragement_and_hate/gr42zum/,[deleted],[removed],0.0
gr4a6a3,https://www.reddit.com/r/iamatotalpieceofshit/comments/m5l1oz/a_lot_of_racism_suicide_encouragement_and_hate/gr4a6a3/,TheDemopan3,That makes you no different,-0.296
gr4abbo,https://www.reddit.com/r/iamatotalpieceofshit/comments/m5l1oz/a_lot_of_racism_suicide_encouragement_and_hate/gr4abbo/,Persona_3fanboy,"I'd love for him to die in game lol. Still, this guy's a complete ass. The actual fact that he said that could've actually LEAD to the act of suicide. And he's a racist. Fun.",-0.765
gr4alh9,https://www.reddit.com/r/iamatotalpieceofshit/comments/m5l1oz/a_lot_of_racism_suicide_encouragement_and_hate/gr4alh9/,Persona_3fanboy,Well being abke to spread this kind of behavior is way better. People have more knowledge that people like this exist and apex can try to counteract it.,0.7579
gr4ctcz,https://www.reddit.com/r/iamatotalpieceofshit/comments/m5l1oz/a_lot_of_racism_suicide_encouragement_and_hate/gr4ctcz/,jadelemental,What am I suppose to do then? let them be shitty to me?,-0.6072
gr4dze5,https://www.reddit.com/r/iamatotalpieceofshit/comments/m5l1oz/a_lot_of_racism_suicide_encouragement_and_hate/gr4dze5/,TheDemopan3,"Look at any other comment in this thread. You can mute them if you want, or just ignore them",-0.296
gr4fs2b,https://www.reddit.com/r/iamatotalpieceofshit/comments/m5l1oz/a_lot_of_racism_suicide_encouragement_and_hate/gr4fs2b/,jadelemental,I meant in real life.,0.0
gr4hq8y,https://www.reddit.com/r/iamatotalpieceofshit/comments/m5l1oz/a_lot_of_racism_suicide_encouragement_and_hate/gr4hq8y/,baxy67,Xbox 360 just moved to Playstation or Xbox one its never been over,0.0
gr4k35i,https://www.reddit.com/r/iamatotalpieceofshit/comments/m5l1oz/a_lot_of_racism_suicide_encouragement_and_hate/gr4k35i/,lolacksdee,"i really hope someone around here finds his address and sends it to police,he must pay every bit of penny he has,at least the economy would get better because government takes away his money",0.6901
gr5i0sr,https://www.reddit.com/r/iamatotalpieceofshit/comments/m5l1oz/a_lot_of_racism_suicide_encouragement_and_hate/gr5i0sr/,myworld4now,I wouldn’t take it personally. Probably wasn’t meant for you to hear since he’s probably talking shit to himself for how pathetic his life is and was talking himself into jumping out of his window 😑,-0.8074
gr61gt7,https://www.reddit.com/r/iamatotalpieceofshit/comments/m5l1oz/a_lot_of_racism_suicide_encouragement_and_hate/gr61gt7/,LigmaNutz69420,Now thats what I call edge.,0.0
gr631j9,https://www.reddit.com/r/iamatotalpieceofshit/comments/m5l1oz/a_lot_of_racism_suicide_encouragement_and_hate/gr631j9/,Pools_closed_guy,I'm having mw2 flashbacks rn,0.0
gr6nwou,https://www.reddit.com/r/iamatotalpieceofshit/comments/m5l1oz/a_lot_of_racism_suicide_encouragement_and_hate/gr6nwou/,MC_Batsy,"Yeah, it is, unfortunately. There is a minority of Arabs in Iran who face discrimination, and a minority of Persians in eastern Arab countries who face discrimination. Additionally, in recent history, there was the Iraq-Iran war, and more recently, the cold war between between Saudi Arabia and Iran. Nationalism and racism suck no matter where they are.",-0.9439
gr6wt8u,https://www.reddit.com/r/iamatotalpieceofshit/comments/m5l1oz/a_lot_of_racism_suicide_encouragement_and_hate/gr6wt8u/,SmolScrub-,That was awful but sick heirloom how many packs did you open to get it?,-0.7543
gr6xp9u,https://www.reddit.com/r/iamatotalpieceofshit/comments/m5l1oz/a_lot_of_racism_suicide_encouragement_and_hate/gr6xp9u/,NachoTheCreator,"Hop on modern warfare 2, you will need more warnings at the start of the video",-0.5709
gr73t03,https://www.reddit.com/r/iamatotalpieceofshit/comments/m5l1oz/a_lot_of_racism_suicide_encouragement_and_hate/gr73t03/,Mrrottenmerican,Well I’ll stay in platinum,0.2732
gr7439i,https://www.reddit.com/r/iamatotalpieceofshit/comments/m5l1oz/a_lot_of_racism_suicide_encouragement_and_hate/gr7439i/,Mrrottenmerican,Find his work,0.0
gr7gg83,https://www.reddit.com/r/iamatotalpieceofshit/comments/m5l1oz/a_lot_of_racism_suicide_encouragement_and_hate/gr7gg83/,ManbadFerrara,"Wow, that's simultaneously really interesting and really a shame. Fully agreed on the last sentence.",0.7276
gr7i7lk,https://www.reddit.com/r/iamatotalpieceofshit/comments/m5l1oz/a_lot_of_racism_suicide_encouragement_and_hate/gr7i7lk/,[deleted],[removed],0.0
gr7mfot,https://www.reddit.com/r/iamatotalpieceofshit/comments/m5l1oz/a_lot_of_racism_suicide_encouragement_and_hate/gr7mfot/,[deleted],[removed],0.0
gr7qwwb,https://www.reddit.com/r/iamatotalpieceofshit/comments/m5l1oz/a_lot_of_racism_suicide_encouragement_and_hate/gr7qwwb/,MaffeW_T,Average game of DotA for me.,0.0
gr8wf06,https://www.reddit.com/r/iamatotalpieceofshit/comments/m5l1oz/a_lot_of_racism_suicide_encouragement_and_hate/gr8wf06/,turtlesareyes,Apex really pisses people off. Damn. Fucking manchild,-0.659
gv3ko7e,https://www.reddit.com/r/iamatotalpieceofshit/comments/m5l1oz/a_lot_of_racism_suicide_encouragement_and_hate/gv3ko7e/,I_Drink_Bleach58,Wait a minute...,0.0
gv3kvro,https://www.reddit.com/r/iamatotalpieceofshit/comments/m5l1oz/a_lot_of_racism_suicide_encouragement_and_hate/gv3kvro/,I_Drink_Bleach58,A lot of people seem to have jerked off to high school sex ed like sheeee,0.1779
m5l1oz,https://www.reddit.com/r/iamatotalpieceofshit/comments/m5l1oz/a_lot_of_racism_suicide_encouragement_and_hate/,AshfordTN_Backup,,0.0
