g2ma2co,https://www.reddit.com/r/kpopnoir/comments/ifa34n/six_black_people_with_experience_living_in_korea/g2ma2co/,AutoModerator,"Thank you for posting ar r/kpopnoir!
The original poster and commenters will have hopefully read over the rules befor posting. If not, they may receive a removal without warning. Proceed well~

*I am a bot, and this action was performed automatically. Please [contact the moderators of this subreddit](/message/compose/?to=/r/kpopnoir) if you have any questions or concerns.*",0.8524
g2mbu1v,https://www.reddit.com/r/kpopnoir/comments/ifa34n/six_black_people_with_experience_living_in_korea/g2mbu1v/,doubleupxx,"netizenbuzz needs to be abolished 😭 after what netizens did to Tablo, I have a really hard time taking any of them seriously. 

I’m interested in seeing the actual segment though! Sam really got these news outlets talking about blackface and anti-black racism, that’s a big step forward!",-0.8165
g2mzbi4,https://www.reddit.com/r/kpopnoir/comments/ifa34n/six_black_people_with_experience_living_in_korea/g2mzbi4/,Intelligent_Still823,What happened to Tablo?,0.0
g2n0ck9,https://www.reddit.com/r/kpopnoir/comments/ifa34n/six_black_people_with_experience_living_in_korea/g2n0ck9/,[deleted],[deleted],0.0
g2n0eid,https://www.reddit.com/r/kpopnoir/comments/ifa34n/six_black_people_with_experience_living_in_korea/g2n0eid/,doubleupxx,"[This](https://www.wired.com/2012/04/ff_koreanrapper/) is a great article about his whole Tajinyo scandal. Basically, there was a large group of netizens that believed he didn’t actually graduate from Stanford and falsified his diploma and it became a huge witch-hunt.",0.2263
g2obfsg,https://www.reddit.com/r/kpopnoir/comments/ifa34n/six_black_people_with_experience_living_in_korea/g2obfsg/,lovelysweetangel89,ugh the site comments gives me high blood pressure especially on the sam okyere event. the anti-blackness is off the charts over there.,-0.6124
ifa34n,https://www.reddit.com/r/kpopnoir/comments/ifa34n/six_black_people_with_experience_living_in_korea/,thursdayzzz,,0.0
