gr0fm5a,https://www.reddit.com/r/iamatotalpieceofshit/comments/m5l1oz/a_lot_of_racism_suicide_encouragement_and_hate/gr0fm5a/,AutoModerator,"**Reminder: Do not ask for personal information, suggest someone should be doxxed, link to or comment with personal information, openly solicit personal information, or contact the people featured here. Don't even wax poetic about wanting to post identifying information. You will be banned.**

**Do not encourage, glorify, or incite violence.**

For example: ""Kill yourself"", ""It wouldn't be so bad if we killed all the pedophiles"", ""This guy needs to die"", ""I hope this guy gets stabbed to death with a rusty screwdriver"", etc.

All glorification, advocacy, or suggestions of violence, EVEN IN JEST, will be permanently banned, no exceptions, and no possibility of leniency. 

**ANY INFORMATION THAT CAN BE USED TO IDENTIFY SOMEONE MUST BE CENSORED.**

**DO NOT POST SCREENSHOTS OF REDDIT CONTENT. DO NOT POST REDDIT DRAMA THAT YOU ARE INVOLVED IN.**

This subreddit is not here to help you win your reddit fight or to bring justice to someone who said something you disagree with. You will be banned if you post screenshots of anything that can be found on Reddit from the information in the screenshot or from comments in your user history. We are not your personal army. 

Failure to follow the rules of this sub will result in a permanent ban.
      


*I am a bot, and this action was performed automatically. Please [contact the moderators of this subreddit](/message/compose/?to=/r/iamatotalpieceofshit) if you have any questions or concerns.*",-0.9945
gr0fty6,https://www.reddit.com/r/iamatotalpieceofshit/comments/m5l1oz/a_lot_of_racism_suicide_encouragement_and_hate/gr0fty6/,Narruin,There is mute for voice chat.,0.0
gr0fvwb,https://www.reddit.com/r/iamatotalpieceofshit/comments/m5l1oz/a_lot_of_racism_suicide_encouragement_and_hate/gr0fvwb/,[deleted],[removed],0.0
gr0g2js,https://www.reddit.com/r/iamatotalpieceofshit/comments/m5l1oz/a_lot_of_racism_suicide_encouragement_and_hate/gr0g2js/,AshfordTN_Backup,"Obviously, but this is not about me or my feelings, I couldn't care less, this is about how low some people can get for absolutely no reason.",-0.8531
gr0giio,https://www.reddit.com/r/iamatotalpieceofshit/comments/m5l1oz/a_lot_of_racism_suicide_encouragement_and_hate/gr0giio/,colinthecommie,Im not laughing because i think what hes saying is funny im laughing because you can tell hes probably projecting with most of the insults,0.1048
gr0hv2w,https://www.reddit.com/r/iamatotalpieceofshit/comments/m5l1oz/a_lot_of_racism_suicide_encouragement_and_hate/gr0hv2w/,Kanes_Black_Hand,What a sad pathetic life they must live to need to do shit like that.,-0.836
gr0k0xt,https://www.reddit.com/r/iamatotalpieceofshit/comments/m5l1oz/a_lot_of_racism_suicide_encouragement_and_hate/gr0k0xt/,obama-care777,Must be new to gaming,0.0
gr0k601,https://www.reddit.com/r/iamatotalpieceofshit/comments/m5l1oz/a_lot_of_racism_suicide_encouragement_and_hate/gr0k601/,[deleted],[removed],0.0
gr0m26m,https://www.reddit.com/r/iamatotalpieceofshit/comments/m5l1oz/a_lot_of_racism_suicide_encouragement_and_hate/gr0m26m/,XxpillowprincessxX,"&gt; I’m in the same division as you 

I’ve never played this game, but I’m assuming if they’re in the same division they must be somewhat equal players?",-0.1326
gr0owzb,https://www.reddit.com/r/iamatotalpieceofshit/comments/m5l1oz/a_lot_of_racism_suicide_encouragement_and_hate/gr0owzb/,[deleted],[removed],0.0
gr0r0cw,https://www.reddit.com/r/iamatotalpieceofshit/comments/m5l1oz/a_lot_of_racism_suicide_encouragement_and_hate/gr0r0cw/,Cyborger1,"From what I can gather, it's a Bronze, Silver, Gold, Platinum, Diamond, Master and I, II, III, IV ranking system, with an extra Apex Predator ranking for the top global players. Looking at the end of the video, it seems they're both Diamond IV.",0.6808
gr0swuw,https://www.reddit.com/r/iamatotalpieceofshit/comments/m5l1oz/a_lot_of_racism_suicide_encouragement_and_hate/gr0swuw/,[deleted],[removed],0.0
gr0t2fy,https://www.reddit.com/r/iamatotalpieceofshit/comments/m5l1oz/a_lot_of_racism_suicide_encouragement_and_hate/gr0t2fy/,I_Drink_Bleach58,The guy in the vid is the kind of person who jerked off during High School sex ed.,-0.2023
gr0tsmv,https://www.reddit.com/r/iamatotalpieceofshit/comments/m5l1oz/a_lot_of_racism_suicide_encouragement_and_hate/gr0tsmv/,FuntimeLuke0531,Because screaming racist shit and telling someone to kill themselves for three and a half minutes just screams big ball energy,-0.9432
gr0xgwt,https://www.reddit.com/r/iamatotalpieceofshit/comments/m5l1oz/a_lot_of_racism_suicide_encouragement_and_hate/gr0xgwt/,XxpillowprincessxX,"So not horrible, but the racist dude isn't a very good player either? Haha 

\\s so other Bronze-Plat players don't get triggered",-0.5954
gr0zhdb,https://www.reddit.com/r/iamatotalpieceofshit/comments/m5l1oz/a_lot_of_racism_suicide_encouragement_and_hate/gr0zhdb/,[deleted],[removed],0.0
gr0zxx4,https://www.reddit.com/r/iamatotalpieceofshit/comments/m5l1oz/a_lot_of_racism_suicide_encouragement_and_hate/gr0zxx4/,czechRPGdude,you new to multiplayer gaming?,0.0
gr10kzq,https://www.reddit.com/r/iamatotalpieceofshit/comments/m5l1oz/a_lot_of_racism_suicide_encouragement_and_hate/gr10kzq/,Macabre999,"you could've left but stayed in the game, go be a fake victim somewhere else",-0.7783
gr11nnn,https://www.reddit.com/r/iamatotalpieceofshit/comments/m5l1oz/a_lot_of_racism_suicide_encouragement_and_hate/gr11nnn/,AshfordTN_Backup,"Shame, it's a ranked game you can't actually leave :) 
Get your shit together before forming a reply.
I ain't trying to be no victim, just sharing what I came across today",-0.6617
gr12ndf,https://www.reddit.com/r/iamatotalpieceofshit/comments/m5l1oz/a_lot_of_racism_suicide_encouragement_and_hate/gr12ndf/,Deadbox_88,You can’t mute them half way through the game,0.0
gr12ryw,https://www.reddit.com/r/iamatotalpieceofshit/comments/m5l1oz/a_lot_of_racism_suicide_encouragement_and_hate/gr12ryw/,Deadbox_88,"I play apex I feel your pain bro. Trust me when I say I know why you stuck around, I deal with shit like this all the time because I’m actually bad at the game",-0.6369
gr13nxp,https://www.reddit.com/r/iamatotalpieceofshit/comments/m5l1oz/a_lot_of_racism_suicide_encouragement_and_hate/gr13nxp/,AshfordTN_Backup,"Good or bad, we're all allowed to play and have fun, there's no rule restricting new players",0.6229
gr13tb2,https://www.reddit.com/r/iamatotalpieceofshit/comments/m5l1oz/a_lot_of_racism_suicide_encouragement_and_hate/gr13tb2/,Deadbox_88,"Oh I’m not new, I’ve been playing since the game came out, I just straight up suck",-0.0516
gr1411d,https://www.reddit.com/r/iamatotalpieceofshit/comments/m5l1oz/a_lot_of_racism_suicide_encouragement_and_hate/gr1411d/,AshfordTN_Backup,"I'm speaking in general, means good or bad doesn't matter",-0.1714
gr147z3,https://www.reddit.com/r/iamatotalpieceofshit/comments/m5l1oz/a_lot_of_racism_suicide_encouragement_and_hate/gr147z3/,Deadbox_88,"Props on Plat tho, I know how hard that shit is. I’m trying to get passed silver I, but the splits coming up and KC is better for ranked play for me.",0.6652
gr14bde,https://www.reddit.com/r/iamatotalpieceofshit/comments/m5l1oz/a_lot_of_racism_suicide_encouragement_and_hate/gr14bde/,Kenesys,"Theres muting, blocking, leaving, and more. Thats what the internet is, deal with it. You can at least rest easy knowing theyre saying all that solely to offend you. They dont believe it lmao",-0.6182
gr14gj6,https://www.reddit.com/r/iamatotalpieceofshit/comments/m5l1oz/a_lot_of_racism_suicide_encouragement_and_hate/gr14gj6/,AshfordTN_Backup,"Trust me the map isn't a big of a deal, nor the aim. The most important thing is your movement, positioning and your rotations and decision making, calling the shots at the right time decides the outcome of the match.",0.659
gr14oqs,https://www.reddit.com/r/iamatotalpieceofshit/comments/m5l1oz/a_lot_of_racism_suicide_encouragement_and_hate/gr14oqs/,AshfordTN_Backup,I'm not even mad or trying to be a victim lmao I couldn't care less I just shared what I came across today.,0.6041
gr14w2e,https://www.reddit.com/r/iamatotalpieceofshit/comments/m5l1oz/a_lot_of_racism_suicide_encouragement_and_hate/gr14w2e/,-_-rabit99-_-,You have the mental acuity of a shit covered salamander,-0.5574
gr15nno,https://www.reddit.com/r/iamatotalpieceofshit/comments/m5l1oz/a_lot_of_racism_suicide_encouragement_and_hate/gr15nno/,[deleted],[deleted],0.0
gr16h4r,https://www.reddit.com/r/iamatotalpieceofshit/comments/m5l1oz/a_lot_of_racism_suicide_encouragement_and_hate/gr16h4r/,JuBangaz,Incel alert!!!,0.4724
gr171wd,https://www.reddit.com/r/iamatotalpieceofshit/comments/m5l1oz/a_lot_of_racism_suicide_encouragement_and_hate/gr171wd/,Macabre999,"so laughing at this guy makes me an incel, nice logic",0.7425
gr177np,https://www.reddit.com/r/iamatotalpieceofshit/comments/m5l1oz/a_lot_of_racism_suicide_encouragement_and_hate/gr177np/,JuBangaz,Nowhere in your comment did you mention laughing. Try again at what screams incel from your comment.,0.25
gr186c4,https://www.reddit.com/r/iamatotalpieceofshit/comments/m5l1oz/a_lot_of_racism_suicide_encouragement_and_hate/gr186c4/,jadelemental,"I said the same thing when I'm mad, well, without the racist part.",0.2778
gr18q4y,https://www.reddit.com/r/iamatotalpieceofshit/comments/m5l1oz/a_lot_of_racism_suicide_encouragement_and_hate/gr18q4y/,hoptropik_CZ,"Yeah, it's bad but I can't take this seriously. This is like going to 4chan and saying it's toxic, I mean...yeah it is....What now?",0.074
gr19m5w,https://www.reddit.com/r/iamatotalpieceofshit/comments/m5l1oz/a_lot_of_racism_suicide_encouragement_and_hate/gr19m5w/,TheMole_434,"""Now say it without crying""",0.3724
gr1ay0r,https://www.reddit.com/r/iamatotalpieceofshit/comments/m5l1oz/a_lot_of_racism_suicide_encouragement_and_hate/gr1ay0r/,TheStuieGraham,"We all live on the same floating marble, we should all just get on, but I honestly just think that this racist scumbag giving shit is just butt hurt that he sucks at a computer game.",-0.9685
gr1cm1k,https://www.reddit.com/r/iamatotalpieceofshit/comments/m5l1oz/a_lot_of_racism_suicide_encouragement_and_hate/gr1cm1k/,ManbadFerrara,I'm bad at identifying accents; does this guy sound French or Eastern European somehow?,-0.5423
gr1cno9,https://www.reddit.com/r/iamatotalpieceofshit/comments/m5l1oz/a_lot_of_racism_suicide_encouragement_and_hate/gr1cno9/,TheDemopan3,why say it in the first place,0.0
gr1cqbx,https://www.reddit.com/r/iamatotalpieceofshit/comments/m5l1oz/a_lot_of_racism_suicide_encouragement_and_hate/gr1cqbx/,Homosexuql,I though this was gonna be a vid on 2b2t,0.0
gr1d6t8,https://www.reddit.com/r/iamatotalpieceofshit/comments/m5l1oz/a_lot_of_racism_suicide_encouragement_and_hate/gr1d6t8/,lvl60,You havent?,0.0
gr1dbbk,https://www.reddit.com/r/iamatotalpieceofshit/comments/m5l1oz/a_lot_of_racism_suicide_encouragement_and_hate/gr1dbbk/,POOTIS113,lmao ofc he sounds russian,0.5994
gr1degl,https://www.reddit.com/r/iamatotalpieceofshit/comments/m5l1oz/a_lot_of_racism_suicide_encouragement_and_hate/gr1degl/,Tzar_Onyx,Can't take him serious due to his goofy accent lol,0.4628
gr1e5q4,https://www.reddit.com/r/iamatotalpieceofshit/comments/m5l1oz/a_lot_of_racism_suicide_encouragement_and_hate/gr1e5q4/,marcosishes,lmaoo you could tell he ran out of words to use like 30 seconds in,0.3612
gr1eei8,https://www.reddit.com/r/iamatotalpieceofshit/comments/m5l1oz/a_lot_of_racism_suicide_encouragement_and_hate/gr1eei8/,[deleted],[removed],0.0
gr1ei8s,https://www.reddit.com/r/iamatotalpieceofshit/comments/m5l1oz/a_lot_of_racism_suicide_encouragement_and_hate/gr1ei8s/,DrForskin,This is why I don’t play multiplayer games,0.34
gr1fvh7,https://www.reddit.com/r/iamatotalpieceofshit/comments/m5l1oz/a_lot_of_racism_suicide_encouragement_and_hate/gr1fvh7/,MehboiMEHBOI,Why did he start swearing at you,-0.25
gr1h408,https://www.reddit.com/r/iamatotalpieceofshit/comments/m5l1oz/a_lot_of_racism_suicide_encouragement_and_hate/gr1h408/,Talerthegamer,I am so sorry you had to deal with that but hey good thing you never talked back thats  a good thing also he is getting mad at you for being right that guy is just a pos,0.4641
gr1ht3d,https://www.reddit.com/r/iamatotalpieceofshit/comments/m5l1oz/a_lot_of_racism_suicide_encouragement_and_hate/gr1ht3d/,lolthepoi,You can trash talk back at them. Clearly your feelings are hurt since you posted this on reddit to shame these random players.,-0.5859
gr1k5dt,https://www.reddit.com/r/iamatotalpieceofshit/comments/m5l1oz/a_lot_of_racism_suicide_encouragement_and_hate/gr1k5dt/,[deleted],[removed],0.0
gr1kt9v,https://www.reddit.com/r/iamatotalpieceofshit/comments/m5l1oz/a_lot_of_racism_suicide_encouragement_and_hate/gr1kt9v/,GripofDoom,"What a seething loser, people that get this salty over Video Games shouldn't BE allowed to Play them",-0.25
gr1marw,https://www.reddit.com/r/iamatotalpieceofshit/comments/m5l1oz/a_lot_of_racism_suicide_encouragement_and_hate/gr1marw/,unkownperson9637,First time?,0.0
gr1me6v,https://www.reddit.com/r/iamatotalpieceofshit/comments/m5l1oz/a_lot_of_racism_suicide_encouragement_and_hate/gr1me6v/,partymike315,bro you have the will of god to have not said shit back i would have eaten him alive,0.7666
gr1mmwu,https://www.reddit.com/r/iamatotalpieceofshit/comments/m5l1oz/a_lot_of_racism_suicide_encouragement_and_hate/gr1mmwu/,justaccforupvotin,Easteen european,0.0
gr1n7ri,https://www.reddit.com/r/iamatotalpieceofshit/comments/m5l1oz/a_lot_of_racism_suicide_encouragement_and_hate/gr1n7ri/,THE_machinist19,Lol that's the first thing I thought,0.4215
gr1nfu0,https://www.reddit.com/r/iamatotalpieceofshit/comments/m5l1oz/a_lot_of_racism_suicide_encouragement_and_hate/gr1nfu0/,[deleted],[removed],0.0
gr1no87,https://www.reddit.com/r/iamatotalpieceofshit/comments/m5l1oz/a_lot_of_racism_suicide_encouragement_and_hate/gr1no87/,Z4mb0ni,This is straight from XBox live 360 days,0.2263
gr1ouyx,https://www.reddit.com/r/iamatotalpieceofshit/comments/m5l1oz/a_lot_of_racism_suicide_encouragement_and_hate/gr1ouyx/,Tommyy_98,"It's not a french accent for sure, he sound Arab ironically",0.3182
gr1p6kr,https://www.reddit.com/r/iamatotalpieceofshit/comments/m5l1oz/a_lot_of_racism_suicide_encouragement_and_hate/gr1p6kr/,Tommyy_98,"Classic trash talk in a video game, I would have actually laugh if it was aiming to me because you damn know he is projecting.",0.2263
gr1p9ql,https://www.reddit.com/r/iamatotalpieceofshit/comments/m5l1oz/a_lot_of_racism_suicide_encouragement_and_hate/gr1p9ql/,HammerBruh,Just mute em stupid,-0.5267
gr1v5ky,https://www.reddit.com/r/iamatotalpieceofshit/comments/m5l1oz/a_lot_of_racism_suicide_encouragement_and_hate/gr1v5ky/,[deleted],[removed],0.0
gr21oe8,https://www.reddit.com/r/iamatotalpieceofshit/comments/m5l1oz/a_lot_of_racism_suicide_encouragement_and_hate/gr21oe8/,[deleted],[removed],0.0
gr23sue,https://www.reddit.com/r/iamatotalpieceofshit/comments/m5l1oz/a_lot_of_racism_suicide_encouragement_and_hate/gr23sue/,Bigenemy000,Actually no. I suggested Op to post it here so that there's higher chance that this asshole will get banned because there's more people who know about him,-0.25
gr23usu,https://www.reddit.com/r/iamatotalpieceofshit/comments/m5l1oz/a_lot_of_racism_suicide_encouragement_and_hate/gr23usu/,Bigenemy000,Actually no. I suggested Op to post it here so that there's higher chance that this asshole will get banned because there's more people who know about him,-0.25
gr23vld,https://www.reddit.com/r/iamatotalpieceofshit/comments/m5l1oz/a_lot_of_racism_suicide_encouragement_and_hate/gr23vld/,[deleted],[removed],0.0
gr24x6c,https://www.reddit.com/r/iamatotalpieceofshit/comments/m5l1oz/a_lot_of_racism_suicide_encouragement_and_hate/gr24x6c/,njo1,Mute  him?,0.0
gr273fe,https://www.reddit.com/r/iamatotalpieceofshit/comments/m5l1oz/a_lot_of_racism_suicide_encouragement_and_hate/gr273fe/,[deleted],[removed],0.0
gr27c9v,https://www.reddit.com/r/iamatotalpieceofshit/comments/m5l1oz/a_lot_of_racism_suicide_encouragement_and_hate/gr27c9v/,YourDadsASpiv,He sounds like he's about to start crying lol,0.296
gr27n6l,https://www.reddit.com/r/iamatotalpieceofshit/comments/m5l1oz/a_lot_of_racism_suicide_encouragement_and_hate/gr27n6l/,[deleted],[removed],0.0
gr27r35,https://www.reddit.com/r/iamatotalpieceofshit/comments/m5l1oz/a_lot_of_racism_suicide_encouragement_and_hate/gr27r35/,Mimzitheclown,Victim blaming alert,-0.4767
gr27tty,https://www.reddit.com/r/iamatotalpieceofshit/comments/m5l1oz/a_lot_of_racism_suicide_encouragement_and_hate/gr27tty/,Mimzitheclown,I wish he died (in game) so he could have ate his words,-0.2263
gr2884u,https://www.reddit.com/r/iamatotalpieceofshit/comments/m5l1oz/a_lot_of_racism_suicide_encouragement_and_hate/gr2884u/,celestialstupidity,Can you believe he learned English just to trash talk to 9 year olds?,0.0
gr2987u,https://www.reddit.com/r/iamatotalpieceofshit/comments/m5l1oz/a_lot_of_racism_suicide_encouragement_and_hate/gr2987u/,Late47,Lol not after his ban,0.6931
gr29eoz,https://www.reddit.com/r/iamatotalpieceofshit/comments/m5l1oz/a_lot_of_racism_suicide_encouragement_and_hate/gr29eoz/,FireMaker125,Dude’s acting like he’s in a 2009 COD Xbox Live lobby lol,0.6597
gr2ahyj,https://www.reddit.com/r/iamatotalpieceofshit/comments/m5l1oz/a_lot_of_racism_suicide_encouragement_and_hate/gr2ahyj/,g8torsni9per,you posted it to reddit because he said something racist this happens all the time you're not special,-0.7398
gr2avvq,https://www.reddit.com/r/iamatotalpieceofshit/comments/m5l1oz/a_lot_of_racism_suicide_encouragement_and_hate/gr2avvq/,[deleted],[removed],0.0
gr2bctj,https://www.reddit.com/r/iamatotalpieceofshit/comments/m5l1oz/a_lot_of_racism_suicide_encouragement_and_hate/gr2bctj/,[deleted],[removed],0.0
gr2bls9,https://www.reddit.com/r/iamatotalpieceofshit/comments/m5l1oz/a_lot_of_racism_suicide_encouragement_and_hate/gr2bls9/,[deleted],[removed],0.0
gr2cq7s,https://www.reddit.com/r/iamatotalpieceofshit/comments/m5l1oz/a_lot_of_racism_suicide_encouragement_and_hate/gr2cq7s/,[deleted],[removed],0.0
gr2cz9b,https://www.reddit.com/r/iamatotalpieceofshit/comments/m5l1oz/a_lot_of_racism_suicide_encouragement_and_hate/gr2cz9b/,343-guilty-mendicant,Gamers doing what gamers do best,0.6369
gr2ep0y,https://www.reddit.com/r/iamatotalpieceofshit/comments/m5l1oz/a_lot_of_racism_suicide_encouragement_and_hate/gr2ep0y/,ChunkyDay,No game is fun enough to endure that bullshit.,-0.4019
gr2fa31,https://www.reddit.com/r/iamatotalpieceofshit/comments/m5l1oz/a_lot_of_racism_suicide_encouragement_and_hate/gr2fa31/,Geronimo417,"Dude sounds in his 30s but he's got the mentality of a 6 six year old on meth. ""Be a man"", says the boy who takes games way too seriously.",-0.2617
gr2fk3l,https://www.reddit.com/r/iamatotalpieceofshit/comments/m5l1oz/a_lot_of_racism_suicide_encouragement_and_hate/gr2fk3l/,[deleted],[removed],0.0
gr2hm3w,https://www.reddit.com/r/iamatotalpieceofshit/comments/m5l1oz/a_lot_of_racism_suicide_encouragement_and_hate/gr2hm3w/,Regular_Turnip_3375,I just don’t wear a headset.,0.0
gr2hmbw,https://www.reddit.com/r/iamatotalpieceofshit/comments/m5l1oz/a_lot_of_racism_suicide_encouragement_and_hate/gr2hmbw/,Luenngokulos,"How can you have this much hate in you? Is this guy okay? Does he need help? Maybe a hug? Jesus man, I play MMOs myself (well not shooters but RPGs) and people are always so toxic. I'm toxic myself sometimes but I would never tell somebody to die or kill themselves. What the heck. Damn bro just get some Coffee and a piece of cake, maybe chocolate idk but you sir need therapy.

btw : best insult for me in my mmo was ""I hope your family dies in a fire on christmas eve"" like damn bro. That was oddly specific thanks.",-0.8782
gr2iplw,https://www.reddit.com/r/iamatotalpieceofshit/comments/m5l1oz/a_lot_of_racism_suicide_encouragement_and_hate/gr2iplw/,[deleted],[removed],0.0
gr2jknr,https://www.reddit.com/r/iamatotalpieceofshit/comments/m5l1oz/a_lot_of_racism_suicide_encouragement_and_hate/gr2jknr/,TehEpikNuwbie,"On behalf of octane mains I apologize for his negligence, arrogance and all around poor behavior.",-0.7269
gr2mkvn,https://www.reddit.com/r/iamatotalpieceofshit/comments/m5l1oz/a_lot_of_racism_suicide_encouragement_and_hate/gr2mkvn/,DeltaPositionReady,"Bang rocks together.

Oof.

Oog.

Oof.",0.0
gr2mxxq,https://www.reddit.com/r/iamatotalpieceofshit/comments/m5l1oz/a_lot_of_racism_suicide_encouragement_and_hate/gr2mxxq/,CanadianWhatever,"Dude needs a psychologist, a hug, and a ban.",-0.128
gr2n55w,https://www.reddit.com/r/iamatotalpieceofshit/comments/m5l1oz/a_lot_of_racism_suicide_encouragement_and_hate/gr2n55w/,CanadianWhatever,You tell people to kill themselves? Why?,-0.7236
gr2obb5,https://www.reddit.com/r/iamatotalpieceofshit/comments/m5l1oz/a_lot_of_racism_suicide_encouragement_and_hate/gr2obb5/,TheTypicalNewGuy,This guy is going to get STDS from Salmon,0.0
gr2olmv,https://www.reddit.com/r/iamatotalpieceofshit/comments/m5l1oz/a_lot_of_racism_suicide_encouragement_and_hate/gr2olmv/,[deleted],[deleted],0.0
gr2ozlh,https://www.reddit.com/r/iamatotalpieceofshit/comments/m5l1oz/a_lot_of_racism_suicide_encouragement_and_hate/gr2ozlh/,bbuettler,"Legend has it he typed ""gg"" when the game was finished",0.0
gr2q3su,https://www.reddit.com/r/iamatotalpieceofshit/comments/m5l1oz/a_lot_of_racism_suicide_encouragement_and_hate/gr2q3su/,obvious_mcduh,wait i thought you were supposed to,0.0
gr2q4pn,https://www.reddit.com/r/iamatotalpieceofshit/comments/m5l1oz/a_lot_of_racism_suicide_encouragement_and_hate/gr2q4pn/,HammerBruh,You’re not wrong,0.3724
gr2qarb,https://www.reddit.com/r/iamatotalpieceofshit/comments/m5l1oz/a_lot_of_racism_suicide_encouragement_and_hate/gr2qarb/,obvious_mcduh,"Thats me and the boys after someone fucks the most irrelevant thing up lol

between ourselves obviously",-0.0772
gr2rgjc,https://www.reddit.com/r/iamatotalpieceofshit/comments/m5l1oz/a_lot_of_racism_suicide_encouragement_and_hate/gr2rgjc/,[deleted],[removed],0.0
gr2w10g,https://www.reddit.com/r/iamatotalpieceofshit/comments/m5l1oz/a_lot_of_racism_suicide_encouragement_and_hate/gr2w10g/,geckoboi27,Unfortunately that’s competitive gaming for you,-0.1779
gr2zqzz,https://www.reddit.com/r/iamatotalpieceofshit/comments/m5l1oz/a_lot_of_racism_suicide_encouragement_and_hate/gr2zqzz/,Mercent_Perrault,This guy doesn't himself know what he's going to say next.,0.0
gr304rw,https://www.reddit.com/r/iamatotalpieceofshit/comments/m5l1oz/a_lot_of_racism_suicide_encouragement_and_hate/gr304rw/,ShakeRegular348,99.99% of the apex community is the complete opposite of this,0.0
gr30kme,https://www.reddit.com/r/iamatotalpieceofshit/comments/m5l1oz/a_lot_of_racism_suicide_encouragement_and_hate/gr30kme/,0megaFlames,You know there's this thing called a mute button right?,0.0
gr30z0w,https://www.reddit.com/r/iamatotalpieceofshit/comments/m5l1oz/a_lot_of_racism_suicide_encouragement_and_hate/gr30z0w/,SallyScott52,Th REAL pos is Op with 1 kill and 4 damage hahaha,-0.6486
gr31dc6,https://www.reddit.com/r/iamatotalpieceofshit/comments/m5l1oz/a_lot_of_racism_suicide_encouragement_and_hate/gr31dc6/,avalonknight645,This was “nice” compared to old cod lobbies. I’ve been called the n word so many times and told that a random family member I’ve had has been fucked dispite not having said family member.,-0.6597
gr31joe,https://www.reddit.com/r/iamatotalpieceofshit/comments/m5l1oz/a_lot_of_racism_suicide_encouragement_and_hate/gr31joe/,jstcarroll,I’m Iranian and he sounds Iranian to me. Unfortunately.,-0.34
gr356cg,https://www.reddit.com/r/iamatotalpieceofshit/comments/m5l1oz/a_lot_of_racism_suicide_encouragement_and_hate/gr356cg/,Blipnarf-The-Boneles,You could’ve just muted him tho,0.0
gr36p4w,https://www.reddit.com/r/iamatotalpieceofshit/comments/m5l1oz/a_lot_of_racism_suicide_encouragement_and_hate/gr36p4w/,Expiriment37B,I think they’re Persian,0.0
gr39u0p,https://www.reddit.com/r/iamatotalpieceofshit/comments/m5l1oz/a_lot_of_racism_suicide_encouragement_and_hate/gr39u0p/,ManbadFerrara,"TBH, that's a little surprising to me. Is Persian vs Arab discrimination common? It makes sense, I just never really thought of it before.",0.204
gr3av7z,https://www.reddit.com/r/iamatotalpieceofshit/comments/m5l1oz/a_lot_of_racism_suicide_encouragement_and_hate/gr3av7z/,TheWordsArePain,"“This guy sounds arab”

No offence but that guy does too lol",0.6303
gr3ay16,https://www.reddit.com/r/iamatotalpieceofshit/comments/m5l1oz/a_lot_of_racism_suicide_encouragement_and_hate/gr3ay16/,TheWordsArePain,Npesta would disagree,-0.3818
gr3caxk,https://www.reddit.com/r/iamatotalpieceofshit/comments/m5l1oz/a_lot_of_racism_suicide_encouragement_and_hate/gr3caxk/,[deleted],[removed],0.0
gr3ee84,https://www.reddit.com/r/iamatotalpieceofshit/comments/m5l1oz/a_lot_of_racism_suicide_encouragement_and_hate/gr3ee84/,spike4379,Imagine being of such a low intelligence you can equate being bad at a game with someone's right to be alive. Wow,0.5994
gr3eppu,https://www.reddit.com/r/iamatotalpieceofshit/comments/m5l1oz/a_lot_of_racism_suicide_encouragement_and_hate/gr3eppu/,wewtangclan,"i have a feeling that all of the dumpster babies on here who say ""mute him"" are also guilty of this type of degeneracy.",-0.4404
