1329267699491409921,https://twitter.com/crossfirebat/status/1329267699491409921,crossfirebat,"Friendly reminder that friendship is more important than political views, so stop breaking apart from friends just because they have different political views, I see it all the time and it's pretty sad that someone would leave someone for something as stupid as that",0.6029
1329405906254241792,https://twitter.com/highbatpony/status/1329405906254241792,highbatpony,@crossfirebat Nope not gonna deal with right wingers as „friend“. If someone wanna be a bigot he can do this without me,0.0
1329362731099631616,https://twitter.com/Walroose64/status/1329362731099631616,Walroose64,@crossfirebat no no it's fine\n*pets bat* we still frens,0.2235
1329362787714424832,https://twitter.com/crossfirebat/status/1329362787714424832,crossfirebat,@Walroose64 Eee,0.0
1329362139291717636,https://twitter.com/crossfirebat/status/1329362139291717636,crossfirebat,@Walroose64 But yeah I'll leave you to online school sorry for the distraction,-0.3291
1329361826816139265,https://twitter.com/crossfirebat/status/1329361826816139265,crossfirebat,"@Walroose64 Exactly the adaptability that's a big issue with a lot of those people, i don't believe it has anything to do with their race or anything (because then the people in other places like US would be the exact same which they aren't) but with the circumstances they've grown up with",0.1901
1329361426243313664,https://twitter.com/crossfirebat/status/1329361426243313664,crossfirebat,"@Walroose64 Once again, i just go off of what I experience, and from what I have experienced so far is that a majority of illegal immigrants are a problem here, the legal ones and some illegal ones are actually fine they actually are really determined to find a job and adapt, but it's ↓",-0.4503
1329360615173976065,https://twitter.com/Walroose64/status/1329360615173976065,Walroose64,"@crossfirebat yeah well all politicians are corrupt in some way so you're definitely correct in using quotation marks there\n\nanyways if you're okay with it I would like to discuss some of this in dms sometime later, I don't think you're racist, but I think some of your beliefs are questionable",0.5646
1329359343460945920,https://twitter.com/crossfirebat/status/1329359343460945920,crossfirebat,"@Walroose64 Good thing that my region is an autonomy, so ""we"" (our region president) do get to decide for ourselves for most things",0.4404
1329359653424214016,https://twitter.com/crossfirebat/status/1329359653424214016,crossfirebat,"@Walroose64 I don't think it's only in italy germany has it as well and austria, that's why they control trucks and cars quite carefully at borders",0.4391
1329360154287017985,https://twitter.com/crossfirebat/status/1329360154287017985,crossfirebat,"@Walroose64 Oh and of course, it's all paid with our money, hence why people are getting mad and why they wanna close the border in the south and really restrict the controls but the south is too currupt to be told to do so, down there it's all ruled by the mafia, it's really sad",-0.8242
1329359307574534144,https://twitter.com/Walroose64/status/1329359307574534144,Walroose64,@crossfirebat italy you silly goose that isn't how refuge is supposed to work,0.0258
1329358824529158146,https://twitter.com/Walroose64/status/1329358824529158146,Walroose64,"@crossfirebat ohh yeah I remember that\n\nunder any other circumstances I would say that's an excuse to not show proof, but in this case, I literally know that they hide this stuff; that's one thing about the italian government that I do know",-0.0772
1329358885178761217,https://twitter.com/crossfirebat/status/1329358885178761217,crossfirebat,"@Walroose64 I did say it before, they get 800€ a month for nothing, refugee in 3-4 star hotels, and free food. And I've seen videos where they complain about the wifi being slow :) not to mention that I see a lot of them with iPhone 11s and smart watches and all that stuff",0.7579
1329357937073123329,https://twitter.com/Walroose64/status/1329357937073123329,Walroose64,@crossfirebat wait do refugees literally get free money\n\nI thought you were just talking about stuff like food stamps\n\nyou give them food and shelter not just straight up cash wtf,0.0859
1329358485956530182,https://twitter.com/crossfirebat/status/1329358485956530182,crossfirebat,@Walroose64 That's just how Italy has been and will probably always be,0.0
1329358326656806912,https://twitter.com/crossfirebat/status/1329358326656806912,crossfirebat,"@Walroose64 There's no official statistics behind it that prove either sides wrong or right because the Italian gouvernment tries to hide things like these, for example by mass reporting about corona or something",-0.5423
1329356941169135617,https://twitter.com/Walroose64/status/1329356941169135617,Walroose64,"@crossfirebat yea sorry I'm way too predisposed to American debates, whenever someone talks about illegal immigrants it's usually an unfounded and totally inaccurate opinion of them, but in this case you might be correct, though I'd have to see the statistics behind it",-0.3506
1329357161386938370,https://twitter.com/crossfirebat/status/1329357161386938370,crossfirebat,"@Walroose64 here. Most people that make it here are people that were doing just fine, but wanted to come here just because it's better in europe, and knowing from people that already came here calling them then, that they get free money, obviously encourages them even more. ↓",0.9267
1329357558084235264,https://twitter.com/crossfirebat/status/1329357558084235264,crossfirebat,@Walroose64 So a lot of people throw away their ID cards and claim they're from those specific assigned war territories and come here and have the excuse that they lost the ID card. Only blood testings then later prove they're not actually from there but you can't do that when there's like↓,-0.4497
1329357736816029696,https://twitter.com/crossfirebat/status/1329357736816029696,crossfirebat,"@Walroose64 Hundreds of people coming every day/week, it would take a lot of time and money and you can't always control it obviously",0.0
1329356734801080320,https://twitter.com/crossfirebat/status/1329356734801080320,crossfirebat,"@Walroose64 Here they're illegal because we are letting in people that come over here to flee from war territories. But most of the time, those actual poor war fugitives don't even make it here, since they have nothing to pay the illegal shippers, that put them on the ships and send them ↓",-0.9623
1329355146787221505,https://twitter.com/crossfirebat/status/1329355146787221505,crossfirebat,"@Walroose64 I definitely know enough to see what the problems of my country are. And illegal immigration is definitely a very big one. Apart from mafia in the south, general poverty, having a lot of debts and a lot of unemployment, again mostly in the south, another big problem is covid ofc",-0.8689
1329356023564537866,https://twitter.com/Walroose64/status/1329356023564537866,Walroose64,"@crossfirebat I'm guessing because it takes a lot more money to travel to America, so the immigrants that come here are usually relatively wealthy in comparison to their home countries\n\nAlso most illegal immigrants are only illegal because they overstayed their visas",-0.7178
1329355839593984000,https://twitter.com/crossfirebat/status/1329355839593984000,crossfirebat,"@Walroose64 No idea who that is and what you're saying, I'm not really aware of all that trans rights stuff and i don't really care and have any interest in it",-0.2605
1329356344525197317,https://twitter.com/Walroose64/status/1329356344525197317,Walroose64,"@crossfirebat well she's a trans woman who hates trans people\n\ntransphobes also hate trans people; but since Blaire White hates trans people too, transphobes consider her ""one of the good ones""",-0.4118
1329355449091690497,https://twitter.com/crossfirebat/status/1329355449091690497,crossfirebat,@Walroose64 Here it's the other way around,0.0
1329355256476655616,https://twitter.com/Walroose64/status/1329355256476655616,Walroose64,"@crossfirebat that's not quite what I mean\n\nit's like how transphobes will validate and respect Blaire White's gender, despite her being trans, simply because she also is transphobic",0.7964
1329354597455065089,https://twitter.com/Walroose64/status/1329354597455065089,Walroose64,"@crossfirebat that's why I said ""at a far lower rate"" as in disproportionately less\n\neven considering the difference in population, immigrants still commit a lot fewer crimes (in America at least)",0.0
1329353908028919808,https://twitter.com/crossfirebat/status/1329353908028919808,crossfirebat,"@Walroose64 Yeah i mean that's what you're supposed to do with all your friends, if they're not one of the good ones, they wouldn't be real friends",0.6854
1329354250309173251,https://twitter.com/Walroose64/status/1329354250309173251,Walroose64,@crossfirebat I feel like I know far too little about policies where you live to have an educated debate,0.3612
1329354188351021056,https://twitter.com/crossfirebat/status/1329354188351021056,crossfirebat,"@Walroose64 Maybe because there's less illegal immigrants than the entire rest of the population, see it doesn't make sense to compare that.",-0.5118
1329353656840450049,https://twitter.com/crossfirebat/status/1329353656840450049,crossfirebat,@Walroose64 And then they're also being spoiled by the system and basically encouraged do do so. So that's not helping either which is why a lot of countries are slowly leaving the EU,0.0896
1329353782719897600,https://twitter.com/Walroose64/status/1329353782719897600,Walroose64,"@crossfirebat statistically, immigrants (even illegal immigrants) commit less crimes\n\nnot sure if it's the same for Europe but in America immigrants commit crimes at a far lower rate than the general population",-0.0488
1329351866975744001,https://twitter.com/Walroose64/status/1329351866975744001,Walroose64,"@crossfirebat because you've classified them as ""one of the good ones""",0.4404
1329353220368510977,https://twitter.com/crossfirebat/status/1329353220368510977,crossfirebat,"@Walroose64 I don't think its part of what race or whatever they are, but the way theyre being raised and their circumstances and it's passed over generations, and generations doesnt apply to the US because they're born there but the ones here, mostly immigrated here illegally, its different",0.0
1329351364879781890,https://twitter.com/Walroose64/status/1329351364879781890,Walroose64,"@crossfirebat I don't doubt that these things are true but the fact you're attributing it to race instead of the individual is what sets off the alarms off in my head\n\nidc how big of a pattern it is, race doesn't matter in that context, and attributing it to race is just race realism",-0.0788
1329352801391161344,https://twitter.com/Walroose64/status/1329352801391161344,Walroose64,"@crossfirebat I get your environment had a big factor in how your beliefs developed, I live in a relatively wealthy suburban area, so I never had these experiences, but again these are just experiences and not statistical fact\n\ninstead of attributing it to race, attribute it to the system",0.1901
1329351564331540481,https://twitter.com/crossfirebat/status/1329351564331540481,crossfirebat,"@Walroose64 Well if I was scared of them, why would I be friends with them?",0.3182
1329350753450856448,https://twitter.com/Walroose64/status/1329350753450856448,Walroose64,@crossfirebat I don't doubt you have black friends but it means literally nothing,0.3828
1329350384905842689,https://twitter.com/crossfirebat/status/1329350384905842689,crossfirebat,"@Walroose64 I have personal experience of multiple african people menacing me for just looking  in their direction and about the people being stabbed in that park is actually true, it's been in the news multiple times. And in newspapers, and literally whitnessed by a friend of mine as well.",0.6369
1329350590988767233,https://twitter.com/crossfirebat/status/1329350590988767233,crossfirebat,@Walroose64 Do I have to link you to their instagram pages or something to make you believe lol?,0.4215
1329349895929683969,https://twitter.com/Walroose64/status/1329349895929683969,Walroose64,@crossfirebat oh my god you're even using the black friends argument... i cant,0.4019
1329349720968486914,https://twitter.com/Walroose64/status/1329349720968486914,Walroose64,"@crossfirebat ok I gotta do schoolwork but it's super obvious to me you've been listening to the wrong people because you are so unaware of how terrible the things you are saying actually are, it's frightening to me that someone can be this unaware\n\nI wanna talk later, I'm actually concerned",-0.8657
1329349320890527748,https://twitter.com/crossfirebat/status/1329349320890527748,crossfirebat,"@Walroose64 Don't put words in my mouth that i didn't say. I explained precisely why I'm sacred to go into that park, not that I'm scared of black people, i actually have a lot of black friends.",0.6711
1329348900805816320,https://twitter.com/crossfirebat/status/1329348900805816320,crossfirebat,@Walroose64 That's not what I said,0.0
1329349708016459779,https://twitter.com/crossfirebat/status/1329349708016459779,crossfirebat,"@Walroose64 Read what I write, and don't only read what you want it to say, but what i actually said",0.0387
1329348811152629760,https://twitter.com/Walroose64/status/1329348811152629760,Walroose64,"@crossfirebat ""I'm not scared of black people I'm just scared of being stabbed by them"" WTF",-0.8371
1329348581430611968,https://twitter.com/Walroose64/status/1329348581430611968,Walroose64,@crossfirebat dude are you legit trolling right now how can you look at what you're saying and not say that it's disgustingly fucking racist what the hell,-0.9299
1329348853183733762,https://twitter.com/crossfirebat/status/1329348853183733762,crossfirebat,"@Walroose64 How is it racist, I'm just telling what's happening, literally everyone is scared to go in that place",-0.7845
1329348290853396482,https://twitter.com/crossfirebat/status/1329348290853396482,crossfirebat,"@Walroose64 1 i didn't say the person is illegal but they are coming here illegally, without permission.\n\n2 I'm not scared of black people, I'm scared to go into the park in the center of my city because literally every week someone gets stabbed there by an african person, ↓",-0.784
1329348637848113152,https://twitter.com/crossfirebat/status/1329348637848113152,crossfirebat,"@Walroose64 And i don't only mean that it's between local people but also between themselves. Every week. It's not funny, it's really scary, thinking that it used to be a fun and nice place to hang out and for kids to play in the park.",0.527
1329347196056121346,https://twitter.com/Walroose64/status/1329347196056121346,Walroose64,@crossfirebat 1) no human should be considered illegal\n\n2) so you admit you're scared of black people,-0.4627
1329347660541734914,https://twitter.com/crossfirebat/status/1329347660541734914,crossfirebat,"@Walroose64 And get pain 800€(from the taxes we pay) a month for doing nothing. I think it's a serious problem and i think it's not because they're so oppressed because they for sure aren't, it's more like they're being spoiled too much by the government",-0.8938
1329348268179017729,https://twitter.com/Walroose64/status/1329348268179017729,Walroose64,@crossfirebat If you're correct here (which I don't know if you are because I'm not involved in European politics) there are still a hell of a lot of red flags in what you just said but regardless\n\nblm is a primarily American movement,-0.4215
1329347179207651329,https://twitter.com/crossfirebat/status/1329347179207651329,crossfirebat,"@Walroose64 Of course there's also the good ones that want to cooperate and adapt but the majority of people that come here from Africa are not even here legally and weren't even from a war territory, they literally throw their IDs away so they can't identify where they're from to get here↓",-0.6902
1329346693607907335,https://twitter.com/crossfirebat/status/1329346693607907335,crossfirebat,"@Walroose64 Since they most definitely are not oppressed here in italy, because they're literally put over the local and legal inhabitants of this country, they get paid with our taxes, that we pay, for what? Doing absolutely nothing but sitting in parks and scaring people and selling drugs",-0.2562
1329346259640053761,https://twitter.com/crossfirebat/status/1329346259640053761,crossfirebat,"@Walroose64 Oh because selling drugs and sex is legal in europe? It's not and it's heavily enforced, now at least in the most part, in italy it's not as bad. And once again guess who is selling them? Black people and foreigners! You see a pattern? I don't think it's being oppressed ↓",0.2691
1329346667456376833,https://twitter.com/Walroose64/status/1329346667456376833,Walroose64,@crossfirebat why do you think they are selling them,0.0
1329344821585186816,https://twitter.com/Walroose64/status/1329344821585186816,Walroose64,"@crossfirebat Drugs and sex work are both heavily criminalized in America, and because of that, gangs have propped up to illegally sell drugs and sex on the black market. Europe isn't as strict with their policies, that's why there aren't as many gangs there.",0.0
1329345582104764417,https://twitter.com/crossfirebat/status/1329345582104764417,crossfirebat,"@Walroose64 Also if you read it carefully it says, ""so as to distinguish them as superior or inferior to the other"" \n\nnot just to distinguish them for their abilities or characteristics. thats not what racism is.",0.7646
1329345927895715843,https://twitter.com/Walroose64/status/1329345927895715843,Walroose64,@crossfirebat that would be race realism which is often used to justify actual racism,-0.6249
1329344165415677953,https://twitter.com/crossfirebat/status/1329344165415677953,crossfirebat,"@Walroose64 I never said they're lazier, just that they tend to not go for what they could do, and i think it's a lot about their mindset that they're put up to because of how much the media supports them.",0.6372
1329345645229076482,https://twitter.com/Walroose64/status/1329345645229076482,Walroose64,@crossfirebat This just sounds like a theory,0.3612
1329343484399128576,https://twitter.com/Walroose64/status/1329343484399128576,Walroose64,"@crossfirebat this isn't a fact about black people it's a common myth spewed out from racists\n\nalso that isn't what racism means, not all racism is obvious\n\nthat second definition describes you; you feel like black people are 'lazier' which is, yes, a racist belief that has never been proven https://t.co/ae5E12XOAD",0.5405
1329344321213112320,https://twitter.com/crossfirebat/status/1329344321213112320,crossfirebat,@Walroose64 War of drugs and sex? In what sense?,-0.644
1329343889845719042,https://twitter.com/Walroose64/status/1329343889845719042,Walroose64,"@crossfirebat Did I say it was okay to do crime because you're poor? I never said that\n\nAnd yes there's a big reason for that; in Europe, they don't have a War on Drugs and a War on Sex like America does, and those are the reason why gangs exist",-0.7361
1329343320997449728,https://twitter.com/crossfirebat/status/1329343320997449728,crossfirebat,"@Walroose64 Oh so because I'm poor I'm justified to be a criminal? Okay let me just Rob a bank real quick, I'm sure it'll be fine, I'm poor i can do whatever I want :)\n\nYou see there's a lot of much poorer people here as well, but they don't go around and do street crime, and theyre starving",-0.9166
1329342607198138371,https://twitter.com/crossfirebat/status/1329342607198138371,crossfirebat,"@Walroose64 But what you're saying is I'm racist, because I point out facts about black people. How is it racist? It's just how it is, being racist is publicallly discriminating them or constantly calling them the n word in attempt to offend them.",-0.9694
1329342068553035777,https://twitter.com/Walroose64/status/1329342068553035777,Walroose64,"@crossfirebat It's because of the wealth gap, not because black people are 'lazier'\n\nSlavery, then Jim Crow, then redlining, and now gerrymandering have all been used to keep black people down in the lower class, and poor people are more likely to be involved in street crime",-0.6808
1329338980299649026,https://twitter.com/Walroose64/status/1329338980299649026,Walroose64,"@crossfirebat Remember when I said ""people who have a problem with blm almost always have super racist opinions""\n\nYeah this is that\nThis take is a massive, massive yikes from me\n\nWhen you're systemically disadvantaged, sometimes the only reliable way to make money is to get involved in gangs",-0.6969
1329341191368925185,https://twitter.com/crossfirebat/status/1329341191368925185,crossfirebat,"@Walroose64 I don't believe they are forced to do it, since a lot of black people still do very good. Of course some people get pulled into it, but it's not the highest part, there's white gangs too just that population is mainly white so it kinda evens itself out cuz more work",0.0249
1329341404129136641,https://twitter.com/crossfirebat/status/1329341404129136641,crossfirebat,"@Walroose64 Again I don't really know much about it, but just from watching it a few times I can tell that they're mainly leftist",0.0
1329341592835076098,https://twitter.com/Walroose64/status/1329341592835076098,Walroose64,"@crossfirebat Trust me, from the perspective of a leftist: no the hell they're not lol",0.5318
1329339224747806726,https://twitter.com/Walroose64/status/1329339224747806726,Walroose64,"@crossfirebat This is not true at all, if you were to say liberal I'd agree with you, but leftist? Fuck no, all those mfs are capitalists, there's no such thing as a leftist capitalist",-0.8159
1329338650002419716,https://twitter.com/crossfirebat/status/1329338650002419716,crossfirebat,"@Walroose64 And it's true that most part of the media is leftist you can not ignore that lol. Of course 95% was an exaggeration, but it's a pretty big part of US media that's leftist.",0.726
1329338046823731200,https://twitter.com/crossfirebat/status/1329338046823731200,crossfirebat,"@Walroose64 I mean that's what I've gathered, and found out, and it's true, you see a lot more black people around doing nothing and just walking around in their gangs than white people, it's not due to them being capable to do less but a lot just don't want to or are being forced not to.",-0.3885
1329338356816285698,https://twitter.com/crossfirebat/status/1329338356816285698,crossfirebat,"@Walroose64 Of course not every black person is like that but a very high percentage is, and even if it's not over 50%, i don't really know those people are still the ones that pull the average wage down by A LOT",0.1901
1329335613989019649,https://twitter.com/Walroose64/status/1329335613989019649,Walroose64,"@crossfirebat And here we come down to the problem.\n\nThere is no evidence that black people are less likely to ""put in more work."" There is no evidence that black people are more or less capable than white people.\n\nAnd the notion that 95% of media is leftist is frankly just absurd tbh",-0.2094
1329332836470562816,https://twitter.com/crossfirebat/status/1329332836470562816,crossfirebat,"@Walroose64 I don't see that, there might be discrimination between people, but I don't see the reporting bias one since 95% of media is leftist, wealth gap is purely down to interest and it just seems like white people on average, put more work in and that's why they make more.",0.9071
1329333113059741699,https://twitter.com/crossfirebat/status/1329333113059741699,crossfirebat,@Walroose64 But what do I know I'm just a dumb european :),-0.1154
1329332068761956353,https://twitter.com/Walroose64/status/1329332068761956353,Walroose64,"@crossfirebat well in the US black people really get the short end of the stick\n\nRacial profiling, reporting bias, racial wealth gap, you name it, black people are very disadvantaged in America",0.228
1329331434239254530,https://twitter.com/crossfirebat/status/1329331434239254530,crossfirebat,"@Walroose64 Here Black people and Foreign people are definitely on the upper hand and the actual local people are being pressured and ""oppressed""",0.2263
1329329410533715968,https://twitter.com/Walroose64/status/1329329410533715968,Walroose64,"@crossfirebat unfortunately sometimes you gotta get your hands dirty to fight for your rights, and black people are still significantly marginalized. I don't support burning down private businesses and homes, but I couldn't care less about what happens to the local Target",-0.8187
1329328449685770240,https://twitter.com/crossfirebat/status/1329328449685770240,crossfirebat,"@Walroose64 But yeah coming back to the original topic, in a server, someone literally left and stopped being good friends with someone else just because of something like this and I think it's completely stupid to do so",0.8628
1329330430961737728,https://twitter.com/Walroose64/status/1329330430961737728,Walroose64,@crossfirebat yea I'm literally a radical leftist and anarcho-communist and that sounds dumb to me,-0.5106
1329329035588087808,https://twitter.com/Walroose64/status/1329329035588087808,Walroose64,"@crossfirebat obviously the rioters aren't innocent, and there's definitely riots that started violent and were never peaceful, I don't deny that\n\npersonally it feels like whenever someone says ""they should just obey the law"" that sounds to me like ""the slaves should have just followed orders""",-0.4815
