gqk2m1j,https://www.reddit.com/r/ask/comments/m2mpih/if_white_people_cant_say_the_n_word_why_can_black/gqk2m1j/,Bakocat,"In the words of a comedian whose name I can't remember, if you compared the badness of two words and refuse to say one of them....that's the worst word. I've never even heard of chicken bone skin tone but as a latino...I can assure there are worst names to call white people.",-0.7096
gqk38vm,https://www.reddit.com/r/ask/comments/m2mpih/if_white_people_cant_say_the_n_word_why_can_black/gqk38vm/,andrewdoestuff,Ok I get it now,0.296
gqkgp6c,https://www.reddit.com/r/ask/comments/m2mpih/if_white_people_cant_say_the_n_word_why_can_black/gqkgp6c/,Victoria__Lehr,"I personally don’t know any white person that takes any words that is supposed to be derogatory towards white people, as derogatory… Mainly because we weren’t the ones that were subjected to years of slavery and horrible treatment and given derogatory names.",-0.8519
gqkojaj,https://www.reddit.com/r/ask/comments/m2mpih/if_white_people_cant_say_the_n_word_why_can_black/gqkojaj/,andrewdoestuff,True,0.4215
gqkv96a,https://www.reddit.com/r/ask/comments/m2mpih/if_white_people_cant_say_the_n_word_why_can_black/gqkv96a/,GotMyOrangeCrush,"Seriously?  You’re easily offended, honky. /s",-0.0772
m2mpih,https://www.reddit.com/r/ask/comments/m2mpih/if_white_people_cant_say_the_n_word_why_can_black/,andrewdoestuff,I'm not asking for the n word pass but chicken bone skin tone is as offensive as the n word imo,-0.6124
